docid,title,event,full_text,worker_1_label,worker_2_label,human_label,outlet_bias
7ec0a751-097c-4862-9ebb-dec241a2431a,This Might Be the Worst Democratic Freak-out Ever,The result left President Trump and other Republicans crowing and Democrats shaking their heads.,"<p>Photo: Joe Raedle/Getty Images</p> <p>Karen Handel’s close-but-not-that-close win in Georgia’s sixth district, the fourth Republican victory in four special elections, has officially made the party’s failure to capture a House seat in 2017 a capital-T Thing. “Let’s be clear: something ain’t working for Democrats, party insiders privately tell us,” reports Politico Playbook. Representative Ro Khanna, sounding like an upset fan calling into a sports talk radio show, called for the party to “fire its consultants” and replace them with three of his favorite opinion journalists. “Deep down [Democrats] know they needed – and still need – a win in a high-profile race in which the fight was between Trump/Republicans and Pelosi/Democrats,” writes Chris Cillizza. “There are no moral victories in politics. No matter what the losing side says — and they always say this — the only thing that really matters when it comes to special elections is the ‘W’ and the ‘L.’”</p> <p>It’s certainly true that Jon Ossoff’s underperformance of the polls (he was nearly tied in the polling average, and is losing by almost 4 points) should incrementally adjust one’s view of the Democrats’ prospects. But the reason the party has lost all four special elections is glaringly simple. It is not some deep and fatal malady afflicting its messaging, platform, consultants, or ad spending allocation methods. Republicans have won the special elections because they’ve all been held in heavily Republican districts.</p> <p>The special elections exist because Donald Trump appointed Republicans in Congress to his administration, carefully selecting ones whose vacancy would not give Democrats a potential opening. It feels like Democrats somehow can’t win, but that is entirely because every contest has been held on heavily Republican turf.</p> <p>The overall measure of Democrats’ standing at the moment is not whether they have won, but how they have performed relative to the partisan composition of the districts in which they are running. That gauge remains quite positive. As Dave Wasserman points out, in the four special elections, they have overperformed the partisan baseline in their districts by an average of 8 percentage points:</p> <p>If that performance holds up in the midterm elections, it would be enough to make Democrats solid favorites to win a House majority. (The undemocratic makeup of the House map means Democrats need to increase their votes by some 6–7 percent in order to gain a majority. Of course, since the midterms don’t take place for more than a year, things could change in either direction. President Trump might change course and pass a popular domestic initiative, or benefit from a foreign crisis, or some kind of racialized conflict provoked by his draconian law-enforcement policies.</p> <p>On the other hand, Trump’s standing could well deteriorate between now and then, given that the only crises he has faced so far are ones he’s created, and his managerial prowess has not exactly inspired confidence. In 2009, Democrats not only won four straight special elections to replace departing House Democrats, they also flipped a House seats from a retiring Republican. Imagine how despondent Democrats would feel if they lost a Democratic seat with Trump in office. At the time, Democrats saw the victory as evidence that they were safe from a midterm wave. “This election represents a double blow for national Republicans and their hopes of translating this summer’s ‘tea party’ energy into victories at the ballot box,” crowed the Democrats’ House campaign chairman. As it turned out, the situation deteriorated pretty badly over the next year.</p> <p>So what accounts for the deep gloom overtaking Democrats? There are the atmospherics of repeatedly losing, which overpower any circumstantial explanation. There is also a long-standing party division over tactics, which gives all sides an incentive to play up the direness of defeat in order to emphasize their own customary remedies. (“My strategy will make our party stronger, but we’re doing fine anyway” is an argument nobody in history has ever made.) And then there is the psychology of surprise. A few months ago, a 4-point Ossoff defeat would have met expectations. After a frenzied nationalized race, it comes as a massive blow, which requires explanations large enough to bear the weight of the trauma it has inflicted upon Democrats.</p> <p>Matthew Ygelsias’s take on Ossoff’s defeat urges Democrats to change course, citing, among other models, “Jeremy Corbyn’s surprisingly strong showing.” Corbyn, of course, lost his race, just as Ossoff did. And Corbyn, unlike Ossoff, ran nationally (rather than in a heavily conservative district) and faced a deeply discredited incumbent. An average Labour nominee not encumbered by Corbyn’s left-wing baggage would probably have won a clear victory. But since Corbyn did lose by less than he had been expected to a few weeks before, momentum transmuted his narrow defeat into a galvanizing victory, just as it transmuted Ossoff’s narrow defeat into a debacle.</p> <p>The final reason for the overreaction is that everybody has priced irrationality into the system. That is, even people who know perfectly well that a swing of a few points one way or another in a single race tells very little about national conditions expect other people to overreact. It is quite possible that Handel’s victory will encourage nervous Republicans to continue holding the line for Trump’s unpopular agenda. But, to the extent the race increases the odds of Congress passing a health-care bill that polls below 20 percent, it would raise, not lower, the chance that Democrats make midterm gains. (Not that many Democrats would take that trade-off.) The irrational-response factor helps rather than hinders Democrats.</p> <p>But perhaps the better response is to take irrationality for granted, and start to act … rational?</p>",Left,Right,X,Left
8662fb3a-a8c3-4be5-82d2-a0d6d7eed3ff,"The Las Vegas Shooter Passed Background Checks, Had Ammonia Nitrate in His Car","Many politicians, members of the media, and other public figures are offering condolences as well as opinions in the wake of the deadliest mass shooting in U.S. history that left at least 58 dead and 500 others injured in Las Vegas Sunday night. Many people on the Left are calling for stricter gun legislation and for Congress to act quickly in response to the shooting. Conversely, many on the Right are saying that the event should not be politicized until all information has been acquired and the dust has settled.","<p>It’s still unclear exactly what the shooter in Las Vegas used to carry out his disgusting attack last night. By all accounts, he had so many weapons that it’ll be a while before we know which ones he chose. Nevertheless, two new pieces of evidence have come to light in the last few hours, and both give us a little insight into who he was and what he was hoping to achieve. The first piece of news is that the killer “passed all required federal background checks” on at least two recent occasions:</p> <p>Two Nevada gun shops confirmed Monday that they sold firearms to Mandalay Bay shooter Stephen Paddock in the last year and said he passed all required background checks. It was unknown if the weapons Paddock bought from the gun shops, New Frontier Armory in North Las Vegas and from Guns and Guitars in Mesquite, were used in the casino massacre.</p> <p>Advertisement</p> <p>Advertisement</p> <p>This doesn’t mean that the shooter didn’t have an automatic weapon as well, although if he did, as opposed to a Gatling crank or a bump fire system that increased the rate of fire on his semi-automatic rifles, he’d have had to obtain it separately and at great effort and cost. (Automatic weapons are extremely expensive — on both the black market and the legal market — and they can only be obtained after the buyer has paid a hefty tax and passed a rigorous and long-lasting federal check.) And it doesn’t mean that the weapons that he bought on these occasions were used in the shooting. What it does mean, however, is that he wasn’t a felon — or, at least, that there was nothing in the federal database that would have prevented him from buying weapons. That matters, because we are already hearing politicians pretend that “universal background checks” would have prevented this attack. They wouldn’t have.</p> <p>The second is that, per the sheriff of the Las Vegas Police Department, the shooter had “ammonia nitrate” in his car. Given the peculiar sophistication of this attack — David French wrote about that earlier — one can only begin to wonder what else he had planned. As far as I understand, ammonia nitrate is an ingredient in what we’d call a “fertilizer bomb.” For whatever reason, this person was serious and he was prepared. Hopefully we’ll soon have some idea of his motive.</p>",Right,Left,X,Right
a67eb9b6-aeda-4688-b571-19d4a0877d78,Ossoff & Handel: Planned Parenthood Spending Falls Short,The result left President Trump and other Republicans crowing and Democrats shaking their heads.,"<p>It’s difficult to determine who ended up as the biggest loser in yesterday’s special election in Georgia’s sixth district. The most obvious choice is Democratic candidate Jon Ossoff, who, despite raising an historic $23 million in campaign funding, could not bring home the victory for his party last night.</p> <p>The Democratic party itself was another dud in Georgia’s sixth. After months of spinning this race as an entirely winnable one — and a referendum on the early days of Donald Trump’s presidency — the party and its advocates are once again being forced to reexamine their strategies and their appeal to American voters.</p> <p>Advertisement</p> <p>Advertisement</p> <p>But one outside group was dealt a particularly heavy blow in Ossoff’s stunning defeat last night: Planned Parenthood. The group’s political-activism arm poured nearly $735,000 into the Democrat’s campaign, a contribution that was topped only by the Democratic Congressional Campaign Committee.</p> <p>After the results came in last night, Planned Parenthood immediately shifted the narrative, attempting to justify its obscene spending levels by portraying the race as some of kind of moral victory. This claim is an exercise in blatant goalpost-moving. Progressives, Planned Parenthood included, insisted throughout that Ossoff had the potential to turn Georgia blue. A loss does no such thing.</p> <p>Planned Parenthood’s activist rhetoric was clearly lacking as well. The abortion group was the campaign’s biggest purveyor of the fiction that Ossoff’s opponent, Republican Karen Handel, had intentionally deprived women of essential health care by severing ties with Planned Parenthood when she served as a vice president for the Susan G. Komen Foundation. But Handel wasn’t the instigator of that policy change; the foundation had considered it for over a decade, largely due to Komen donors’ concerns that their gifts might indirectly fund abortion.</p> <p>By tacking a $735,000 price tag onto Ossoff’s failed effort, Planned Parenthood has revealed its own futility at influencing elections. That failure underscores another important point. Planned Parenthood consistently argues that, if it were to be stripped of its federal funding, millions of women would lose “vital health care.”</p> <p>If money is really so tight over at Planned Parenthood — and if American women are truly in desperate need of life-saving care that they can’t get anywhere else — perhaps the abortion-rights group should think twice before dropping hundreds of thousands on insignificant political races, whether or not those races end in bitter defeat.</p>",Left,Right,X,Right
a925ec23-c69a-43a4-a929-efab562ec79f,"Paglia: Duck Dynasty uproar ‘utterly fascist, utterly Stalinist’",Duck Dynasty Bigotry Controversy,"<p>This 2012 photo released by A&E shows, from left, Phil Robertson, Jase Robertson, Si Robertson and Willie Robertson from the A&E series, ""Duck Dynasty."" The A&E channel says ""Duck Dynasty"" patriarch Phil Robertson is off the show indefinitely after condemning gays as sinners in a magazine interview. In a statement Wednesday, Dec. 18, 2013, A&E said it was extremely disappointed to read Robertson's comments in GQ magazine. (AP Photo/A&E, Zach Dilgard)</p> <p>The suspension of Phil Robertson from A&E’s Duck Dynasty is outrageous in a nation that values freedom, according to social critic and openly gay, dissident feminist Camille Paglia.</p> <p>“I speak with authority here, because I was openly gay before the ‘Stonewall rebellion,’ when it cost you something to be so. And I personally feel as a libertarian that people have the right to free thought and free speech,” Paglia, a professor at the University of the Arts in Philadelphia, said on Laura Ingraham’s radio show Thursday.</p> <p>“In a democratic country, people have the right to be homophobic as well as they have the right to support homosexuality — as I one hundred percent do. If people are basing their views against gays on the Bible, again they have a right of religious freedom there,” she added.</p> <p>Robertson has been suspended from Duck Dynasty due to comments he made to GQ that have been deemed “anti-gay.” According to Paglia, the culture has become too politically correct.</p> <p>“To express yourself in a magazine in an interview — this is the level of punitive PC, utterly fascist, utterly Stalinist, OK, that my liberal colleagues in the Democratic Party and on college campuses have supported and promoted over the last several decades,” Paglia said. “This is the whole legacy of free speech 1960’s that have been lost by my own party.”</p> <p>Paglia went on to point out that while she is an atheist she respects religion and has been frustrated by the intolerance of gay activists.</p> <p>“I think that this intolerance by gay activists toward the full spectrum of human beliefs is a sign of immaturity, juvenility,” Paglia said. “This is not the mark of a true intellectual life. This is why there is no cultural life now in the U.S. Why nothing is of interest coming from the major media in terms of cultural criticism. Why the graduates of the Ivy League with their A, A, A+ grades are complete cultural illiterates, etc. is because they are not being educated in any way to give respect to opposing view points.”</p> <p>“There is a dialogue going on human civilization, for heaven sakes. It’s not just this monologue coming from fanatics who have displaced the religious beliefs of their parents into a political movement,” she added. “And that is what happened to feminism, and that is what happened to gay activism, a fanaticism.”</p> <p>Follow Caroline on Twitter</p>",Right,Left,X,Right
b15c6666-e7fa-4078-8bad-0104714ace6b,Obamacare will push 2 million workers out of labor market: CBO,Obamacare and Jobs,"<p>Obamacare will push the equivalent of about 2 million workers out of the labor market by 2017 as employees decide either to work fewer hours or drop out of the job market altogether, according to estimates released Tuesday by the Congressional Budget Office.</p> <p>The analysis set off a furious debate in Washington. The White House argued that the reduction is positive because it means Americans will forgo jobs or extra work to stay home with their children or strike out on their own as entrepreneurs. Republicans, however, said the report amounted to an “I told you so” moment and that subtracting the equivalent of 2 million workers can’t be good for the economy.</p> <p>The CBO said the number of workers dropping out of the labor force will grow from 2 million in 2017 to 2.5 million by 2024.</p> <p>Although part of those numbers are attributed to job cuts, the vast majority represent workers who decide it makes more sense to stay home or work fewer hours, weighing the higher taxes they pay in the workforce versus their qualifications for benefits if they drop out.</p> <p>“CBO estimates that the ACA will reduce the total number of hours worked, on net, by about 1.5 to 2 percent during the period from 2017 to 2024, almost entirely because workers will choose to supply less labor — given the new taxes and other incentives they will face and the financial benefits some will receive,” the nonpartisan tax agency said in its economic outlook.</p> <p>The CBO also said the Affordable Care Act’s exchanges will enroll 6 million people by the first deadline in March, which is 1 million fewer than earlier projections. But by the end of the decade, the number of people without insurance coverage will have dropped from 45 million today to 30 million, the agency said in its annual update on the economic and budget outlook.</p> <p>Powered by spending cuts, higher taxes and a slowly improving economy, the federal deficit will drop to less than a half-trillion dollars next year but then begin a steady climb to more than $1 trillion a year by 2022, according to CBO projections.</p> <p>Slower recovery</p> <p>The CBO said the economic recovery from the deep recession from December 2007 to June 2009 is taking longer and won’t be as strong as previous recoveries. Analysts say the labor market’s fundamentals have shifted.</p> <p>Obamacare is one part of that because it rearranges incentives for businesses and workers.</p> <p>White House chief economic adviser Jason Furman said the health care law is about giving workers more choices. He compared it to Social Security and Medicare, which he said gave senior citizens the incentives and financial wherewithal to retire.</p> <p>In this case, he said, the CBO’s numbers show that the health care law will let younger workers make decisions about whether to remain in the workforce.</p> <p>“Maybe a spouse who wanted to be part-time so they could spend more time with their family now is able to do that,” Mr. Furman told reporters. “Somebody else who wanted to start a business and become an entrepreneur and was terrified of doing it because they’d lose their health insurance, is now able to do that too, and switch and take a chance on creating jobs and growing the overall economy. So there’s a lot of new choices that this will facilitate.”</p> <p>At the same time, Mr. Furman said he doesn’t agree with the CBO’s numbers. He argues that agency analysts didn’t take into account lower health care costs and higher worker productivity that would create hundreds of thousands of jobs a year.</p> <p>Republicans, though, used the jobs number to attack Senate Democrats seeking re-election in November.</p> <p>“This is one of the perverse incentives in this terrible law. It actually encourages able-bodied people to not work,” said Sen. John Barrasso, Wyoming Republican. “We should be doing all that we can to increase labor force participation. The health care law actually pushes it in the opposite direction.”</p> <p>Deficit progress</p> <p>Taking the budget as a whole, the CBO said Congress has made substantial headway on cutting spending and raising taxes, which will reduce the deficit to $514 billion this year and $478 billion in 2015.</p> <p>But it will rise by 2016 and steadily grow to more than $1 trillion in 2022.</p> <p>The CBO report said the economy isn’t rebounding as fast as is typical after a recession and that poor growth means less revenue for the Treasury. That means the cumulative deficit over the next decade will be $1 trillion more than projected last year.</p> <p>National debt, which is the accumulation of annual deficits, is at its highest level since the aftermath of World War II. The CBO said debt held by the public will represent 80 percent of gross domestic product by 2024, the end of the budget window.</p> <p>The report will give ammunition to those who argued that tax increases or spending cuts should have been delayed while the government pursued more economic stimulus over the past few years.</p> <p>But the CBO suggested that the problems are more structural, given the aging U.S. population and women’s participation in the labor force.</p> <p>The report said the labor market for the rest of this decade will recover more slowly than analysts predicted last year.</p> <p>The analysts said that at the deepest part of the recession, GDP was 7.5 percent below the economy’s potential output. By the end of 2013, just half of that gap had been closed, meaning the economy still has plenty of room to improve.</p> <p>“With output growing so slowly, payrolls have increased slowly as well — and the slack in the labor market that can be seen in the elevated unemployment rate and part of the reduction in the rate of labor force participation mirrors the gap between actual and potential GDP,” the CBO study said.</p>",Right,Left,X,Right
b3a17af5-d043-4f2f-b9e5-8e191d0c8aaa,Cards Against Humanity Is Trying To Sabotage Trump’s Border Wall Construction,"The company behind the popular game Cards Against Humanity has purchased land on the U.S.-Mexico border and hired an eminent domain law firm to make the construction of Trump's border wall ""as time-consuming and expensive as possible.""","<p>CEDAR RAPIDS, IA - JUNE 21: President Donald Trump speaks at a rally on June 21, 2017 in Cedar Rapids, Iowa. Trump spoke about renegotiating NAFTA and building a border wall that would produce solar power during the rally. (Photo by Scott Olson/Getty Images)</p> <p>A company behind a popular card game is trying to sabotage President Donald Trump’s plan to build a wall along the U.S.-Mexico border by purchasing up portions of land in that long horizontal area, and offering potential customers a cut.</p> <p>Known as “a party game for horrible people,” Cards Against Humanity is asking for $15 from visitors to its site in a holiday promotion claiming that in return they’ll receive “six surprises.”</p> <p>One of those gifts, according to the company, is a formal opportunity to buy a plot of land on or right near the border and be covered by legal representation specializing in eminent domain — rendering it not a surprise at all. The goal for the company is “to make it as time-consuming and expensive as possible for the wall to get built.”</p> <p>“Donald Trump is a preposterous golem who is afraid of Mexicans,” reads the website’s promotion called “Cards Against Humanity Saves America.”</p> <p>Ironically, despite the company’s sympathy for immigrants and foreigners, it says in its Frequently Asked Questions (FAQ) section that if a would-be customer doesn’t live in U.S. or Canada, they can’t sign up.</p> <p>“No. This is ‘Cards Against Humanity Saves America,’ not ‘Cards Against Humanity Saves The Dumb Country You Live In,'” the company’s answer reads.</p> <p>Nevertheless, the company says “America will be saved,” specifically from “injustice, lies, racism, the whole enchilada” if people send $15.</p> <p>The jabs at Trump and his administration are aplenty. The business admits that “we’re liars, just like the president.” Furthermore, surprises don’t contain sexual content “or footage of Donald Trump watching Russian prostitutes urinate on a bed Obama slept in,” according to the company.</p> <p>When asking in the FAQ section of the website “Why don’t you just stick to card games?” and not get political, the company retorts in typical sassy fashion: “Why don’t you stick to seeing how many Hot Wheels cars you can fit up your asshole?” (RELATED: In Strange Move, DNC Knocks Trump For Lack Of Progress On Border Wall)</p> <p>All 150,000 slots to sign up for the peculiar gifts sold out within the first day.</p> <p>Cards Against Humanity did not respond to The Daily Caller News Foundation’s request for further details by time of publication.</p> <p>Follow Eric on Twitter</p> <p>Send tips to [email protected].</p> <p>Content created by The Daily Caller News Foundation is available without charge to any eligible news publisher that can provide a large audience. For licensing opportunities of our original content, please contact [email protected].</p>",Left,Right,X,Right
