docid,title,event,full_text,worker_1_label,worker_2_label,human_label,outlet_bias
b5c572aa-2a0c-4db8-a52d-a83cda5cc8d6,"The True Intent Of Indiana’s ‘Religious Freedom’ Bill, According To The People Who Helped Write It ",Indiana To Clarify New Law,"<p>Indiana Gov. Mike Pence (R) and state Republican leaders have been playing damage control this week, claiming that the Religious Freedom Restoration Act is not a law that enables anti-LGBT discrimination. Meanwhile, however, the conservatives who advocated for the bill have been spurning this attempted walkback, asserting in the process that the goal was ensuring discrimination all along.</p> <p>At the forefront of the conservative reaction is Micah Clark, who serves as executive director of the American Family Association of Indiana and who stood right behind Pence as he signed the bill. Speaking Monday to Tim Wildmon, head of the national American Family Association, Clark explained that conservatives should oppose any effort to clarify that the law does not legalize discrimination. “That could totally destroy this bill,” he explained.</p> <p>Clark has been publicly advocating for the bill as a means for allowing anti-LGBT discrimination since December, long before the legislation was even drafted. This directly contradicts the claims made Monday by House Speaker Brian Bosma (R) and Senate President Pro Tem David Long (R) that the legislation never had anything to do with discrimination.</p> <p>Eric Miller, Executive Director of Advance America, is another anti-LGBT activist who stood by Pence as he signed the bill. Advance America praised Pence for signing the bill last week, openly stating that it would allow wedding vendors to refuse to serve same-sex couples and allow Christian businesses to refuse transgender people access to restrooms. Miller was quoted as saying, “It is vitally important to protect religious freedom in Indiana. It’s the right thing to do. It was therefore important to pass Senate Bill 101 in 2015 in order to help protect churches, Christian businesses and individuals from those who want to punish them because of their Biblical beliefs!” Pence and Miller, it turns out, go way back.</p> <p>On the national stage, conservatives are similarly defending the RFRA and arguing it needs no fixing. Andrew Walker, Director of Policy Studies for the Southern Baptist Convention’s Ethics & Religious Liberty Commission, perhaps best summed up the distortion conservatives are using to argue that it’s not discriminatory:</p> <p>A wedding vendor who chooses not to service a same-sex wedding is not discriminating against a person’s being. Instead, the vendor believes that material cooperation in a particular event encroaches on his conscience… To give relief to a particular wedding vendor who feels uncomfortable servicing a gay wedding isn’t in any way comparable to state-sponsored discrimination… To require a wedding vendor to service a same-sex wedding is not eliminating discrimination against the gay couple. It’s coercing the wedding vendor.</p> <p>Walker is simultaneously admitting that the law is designed to allow businesses to discriminate against LGBT people while denying that it’s actually “discrimination” that’s taking place. Radio host Bryan Fischer, formerly of the American Family Association, took the Christian self-victimization a step further. “This law is not something that provides for discrimination against gays,” he explained. “It is something that prevents discrimination against Christians… This thing is an anti-discrimination bill because it prohibits governmental discrimination against Christians in the state of Indiana.”</p> <p>The Heritage Institute’s Ryan T. Anderson used this messaging to try to take on Apple CEO Tim Cook, who wrote an op-ed in the Washington Post this week calling these so-called “religious freedom” laws dangerous. According to Anderson, “the only person in favor of discrimination in this debate is Tim Cook.” As one of his examples, Anderson claims, “It is Tim Cook who would have the government discriminate against these citizens, have the government coerce them into helping to celebrate a same-sex wedding and penalize them if they try to lead their lives in accordance with their faith.”</p> <p>Using as his example Washington florist Barronelle Stutzman — who was fined last week for refusing to serve a same-sex couple — Anderson reiterates the distortion: “This debate has nothing to do with refusing to serve gays simply because they’re gay, and this law wouldn’t protect that. But should the government force a 70-year-old grandmother to violate her beliefs? Should the government coerce her into helping to celebrate a same-sex wedding?” Anderson later highlights Aaron and Melissa Klein, bakery owners who also face fines for refusing service to a same-sex couple, as somehow another example of how RFRA is not about discrimination. He echoed these talking points on MSNBC last night as well, offering the caveat that nothing guarantees a vendor will win if they defend their discrimination with RFRA.</p> <p>The Family Research Council has been making the media rounds as well. In addition to defending Pence and the law on their website, both Tony Perkins and Peter Sprigg have taken to cable news this week to defend their positions. Sprigg went toe-to-toe with CNN’s Chris Cuomo Monday morning, where he acknowledged that wedding vendors trying to discriminate could use the law to defend themselves, but like Anderson, he tried to couch that in the idea that they wouldn’t necessarily win. The only thing these Christian wedding vendors object to, Sprigg suggested, “is using their expressive abilities to communicate a message that they disagree with by saying that marriage can be a union of two men or two women,” adding that it’s “forcing them to do something that violates their faith.”</p> <p>On Fox News Monday night, Perkins continued to falsely conflate Indiana’s RFRA with laws by the same name in other states, adding, “Let’s be very clear what RFRA is. This is a shield to protect one’s belief from government. It is not a sword to be used against anyone else and it cannot be… This is only a defense and it is not an iron-clad defense at that.” Perkins went on to describe the notion that some people want to “force people to engage in a behavior such as weddings — photographers, florists. In a civil society, what we would say is, ‘Oh, you don’t want to service me? Fine, I’ll go next store. I’ll go down the street.’” Borrowing a rather mockable talking point from Mike Huckabee, he added, “Who would fathom the idea of someone going into a Kosher deli and demanding a ham sandwich?”</p> <p>Despite conservatives all asserting that RFRA is designed to allow businesses to refuse to offer products and services to same-sex couples that they offer to others, Pence continued to defend the law as not being discriminatory in a Wall Street Journal op-ed posted Monday evening. Perhaps unsurprisingly, it’s The Onion that has one of the most accurate headlines this week: “Indiana Governor Insists New Law Has Nothing To Do With Thing It Explicitly Intended To Do.”</p>",Right,Left,X,Left
c79f8bca-ae3f-4c8c-b319-413004e05263,"'Duck Dynasty' Star Phil Robertson Makes Anti-Gay Remarks, Says Being Gay Is A Sin [UPDATED]",Duck Dynasty Bigotry Controversy,"<p>Not only does ""Duck Dynasty"" star Phil Robertson fail to understand what it's like to be gay, but he also thinks homosexuality is a sin comparable to bestiality.</p> <p>In a shocking new interview with GQ's Drew Magary, Robertson -- the 67-year-old patriarch of the Duck Commander kingdom that earned his Louisiana family a fortune and a hit A&E series -- opened up about ""modern immorality"" and the gay community.</p> <p>“It seems like, to me, a vagina -- as a man -- would be more desirable than a man’s anus,"" Robertson told GQ. ""That’s just me. I’m just thinking: There’s more there! She’s got more to offer. I mean, come on, dudes! You know what I’m saying? But hey, sin: It’s not logical, my man. It’s just not logical.”</p> <p>“Everything is blurred on what’s right and what’s wrong. Sin becomes fine,"" he later added. “Start with homosexual behavior and just morph out from there. Bestiality, sleeping around with this woman and that woman and that woman and those men. Don’t be deceived. Neither the adulterers, the idolaters, the male prostitutes, the homosexual offenders, the greedy, the drunkards, the slanderers, the swindlers -- they won’t inherit the kingdom of God. Don’t deceive yourself. It’s not right.”</p> <p>To read the full interview, visit GQ.com.</p> <p>Robertson was once a substance abuser, but in the 1970s he turned his life over to Jesus, according to the Christian publication, The Southeast Outlook. He has since been a devout Christian and strives to be a scholar of the Bible.</p> <p>Robertson's anti-gay comments did not sit well with lesbian, gay, bisexual and transgender (LGBT) advocates. GLAAD called his comments some of ""the vilest and most extreme"" uttered against the LGBT community, ""littered with outdated stereotypes and blatant misinformation.""</p> <p>In a statement obtained by The Huffington Post, GLAAD spokesperson Wilson Cruz said:</p> <p>Phil and his family claim to be Christian, but Phil's lies about an entire community fly in the face of what true Christians believe. He clearly knows nothing about gay people or the majority of Louisianans –- and Americans -- who support legal recognition for loving and committed gay and lesbian couples. Phil's decision to push vile and extreme stereotypes is a stain on A&E and his sponsors who now need to reexamine their ties to someone with such public disdain for LGBT people and families.</p> <p>Recently, Robertson and his family were named on Barbara Walters' ""Most Fascinating People of 2013"" list. He snubbed Walters' interview to go duck hunting instead.</p> <p>UPDATE at 12:33pm ET: A representative from A&E sent the following statement to The Huffington Post from Phil Roberston in response to the controversy:</p>",Right,Left,X,Left
ca53fb37-3315-4821-81b5-0f91c5c805e6,Kellyanne Takes A Victory Lap After Ossoff Defeat,The result left President Trump and other Republicans crowing and Democrats shaking their heads.,"<p>Kellyanne Conway, campaign manager and incoming counselor to the president, exits Trump Tower in New York, U.S. November 16, 2016. REUTERS/Eduardo Munoz</p> <p>White House counselor Kellyanne Conway took a victory lap on Twitter after Republican Karen Handel defeated Democrat Jon Ossoff in the special election for Georgia’s Sixth District.</p> <p>Liberals and the media framed the election as a referendum on President Trump and Conway didn’t pass on the opportunity to celebrate Ossoff’s loss in a series of biting tweets late Tuesday night.</p> <p>“Thanks to everyone who breathlessly and snarkily proclaimed #GA06 as a ‘referendum on [President Trump,'” she wrote. You were right.”</p> <p>“Laughing my #Ossoff,” she added later, making a play on a popular pre-election catchphrase among Democrats that instructed voters to “Vote your Ossoff.”</p> <p>Conway took a third shot at Ossoff while congratulating Handel on her victory. The White House counselor thanked Handel for “for standing strong, for running on issues, for being a grownup and for living in the district” — taking a backhanded swipe at Ossoff, who didn’t live in the district he was hoping to represent.</p>",Right,Left,X,Right
cbb65a27-bdbd-4c30-874d-bd3938b3873f,Dear Indiana Republicans: It’s Not That Hard to Survive a Hatestorm,Indiana To Clarify New Law,"<p>In response to A Step Back For Feminism</p> <p>As Quin Hillyer notes, it looks like Indiana Republicans are in the process of “clarifying” their perfectly acceptable, easily defensible religious liberty law — all in the face of a hatestorm that is loud and furious but ultimately empty and powerless.</p> <p>By now, Republicans should know this drill. Any move to protect religious liberty, restrict abortion, or to keep men from playing women’s sports is likely to be met with a Twitter avalanche, calls for boycotts, dozens of hours of breathless MSNBC coverage, and a full Mainstream Media news cycle of outrage.</p> <p>Advertisement</p> <p>Advertisement</p> <p>But so what?</p> <p>If Republican politicians can’t effectively defend a basic religious-freedom law from a fundamentally misleading far-Left attack, answering lies and fury with truth and firm conviction, then we need new Republican politicians. After all, your base stands with you, your critics are largely not your voters, and — even better — they’re far more vulnerable than you are.</p> <p>Will you listen to even one minute of moral instruction from the NCAA, an organization notable mainly for reaping billions of dollars of rewards from the unpaid labors of its athletes, who are often poor and minority?</p> <p>And will you give the slightest credibility to the two minutes hate from Salesforce.com and Apple, two companies who are only too eager to do business in China, a nation with a truly shameful human-rights record?</p> <p>As for Apple, don’t listen to another word from Tim Cook so long as he continues to produce iPhones and iPads at plants with worse working conditions and lower wages than any Indiana workplace, places so bleak that Chinese bosses actually placed suicide nets beneath high windows.</p> <p>Why not have the courage of your convictions and stand by those until the voters — not Twitter — hold you accountable? Remember, the Left doesn’t always properly gauge public opinion on matters of life and liberty.</p> <p>Just ask Governor Wendy Davis.</p>",Left,Right,X,Right
cbcadc49-3c6f-41a8-a211-d78d84a902dd,"Trump says Obama born in US, ‘period’ – after new ‘birther’ dust-up","Donald Trump passed up yet another opportunity to say he accepts the fact that President Barack Obama was born in the United States, promising to make a ""major statement"" on Friday morning.","<p>Donald Trump tried to tamp down a newly revived campaign dust-up Friday over his views on President Obama’s birthplace, declaring the president was born in the United States – “period” – after declining to make that statement earlier this week.</p> <p>The Republican presidential nominee also tried to blame Hillary Clinton for starting the controversy back in 2008, which her team denies. He cast his remarks as a bid to put the issue to rest once and for all, at a time when his poll numbers are rising.</p> <p>“Hillary Clinton and her campaign of 2008 started the birther controversy. I finished it,” Trump said in Washington, D.C. “President Barack Obama was born in the United States, period. Now we all want to get back to making America strong and great again.”</p> <p>He spoke at his new Trump International Hotel in Washington, D.C., a visit that began with lengthy remarks from military supporters and veterans. He briefly addressed the “birther” issue at the end.</p> <p>The statement comes after Trump’s response on the matter in an interview Wednesday revived the issue. In the interview with The Washington Post, Trump was asked whether he believed Obama was born in the U.S. ""I'll answer that question at the right time,"" Trump told the paper. ""I just don't want to answer it yet.""</p> <p>Trump’s campaign spokesman, trying to calm the waters, said overnight the Republican candidate now believes Obama was born in the U.S. Campaign spokesman Jason Miller said Trump ""did a great service to the country"" by bringing closure to the debate.</p> <p>""In 2011, Mr. Trump was finally able to bring this ugly incident to its conclusion by successfully compelling President Obama to release his birth certificate,"" Miller said.</p> <p>But the Clinton campaign seized on Trump’s reluctance to address the issue in his Post interview.</p> <p>Speaking shortly before Trump across town at the Black Women's Agenda Symposium, Clinton said Friday the Republican nominee was “feeding into” the “bigotry and bias that lurks in our country” – and should apologize.</p> <p>“Barack Obama was born in America,” she said. “Donald Trump owes him and the American people an apology.”</p> <p>Her campaign called his Friday comments ""disgraceful.""</p> <p>The dust-up comes as Trump gains on Clinton in national and battleground state polls, even surpassing her in some states.</p> <p>A new Fox News poll shows Clinton topping Trump by just one point among likely voters in the four-way ballot nationally.</p> <p>In the head-to-head matchup, Trump’s up by one point.</p> <p>Both candidates were fundraising Friday after events in Washington. Clinton has endured a rough week on the campaign trail, after criticizing some Trump supporters last Friday as ""deplorables"" and then having to take time off from the campaign due to a bout of pnemonia.</p> <p>She used the birther issue to try and go back on offense.</p> <p>While Obama was born in Hawaii, Trump several years ago was a key figure in stoking the so-called ""birther"" controversy. Critics saw it as an attempt to delegitimize the nation’s first black president.</p> <p>Trump has said repeatedly during the campaign that he no longer talks about the ""birther"" issue.</p> <p>The Trump campaign’s statement late Thursday claimed that Clinton launched the “birther” movement during her unsuccessful primary run against Obama in 2008.</p> <p>""Hillary Clinton's campaign first raised this issue to smear then-candidate Barack Obama in her very nasty, failed 2008 campaign for President,"" the statement said. ""This type of vicious and conniving behavior is straight from the Clinton Playbook. As usual, however, Hillary Clinton was too weak to get an answer.""</p> <p>Clinton has long denied the claim, and fact-checkers previously have found no public evidence that she or her campaign directly pushed the issue. Rather, Trump’s comments appear to refer to reports that Clinton supporters circulated an email during the bitter 2008 primary race questioning Obama’s citizenship.</p> <p>Yet former McClatchy D.C. bureau chief James Asher said on Twitter Friday that Clinton confidant Sidney Blumenthal in fact “told me in person” that Obama was born in Kenya.</p> <p>Obama had released a standard short form of his birth certificate before the 2008 presidential election. Anyone who wants a copy of the more detailed, long-form document must submit a waiver request, and have that request approved by Hawaii's health department.</p> <p>In 2011, amid persistent questions from Trump about his birthplace, Obama submitted a waiver request. He dispatched his personal lawyer to Hawaii to pick up copies and carry the documents back to Washington on a plane.</p> <p>The form said Obama was born at 7:24 p.m. on Aug. 4, 1961, at Kapiolani Maternity and Gynecological Hospital in Honolulu. It is signed by the delivery doctor, Obama's mother and the local registrar.</p> <p>At the White House on Friday, Obama declined to comment at length on the issue, saying he’s got other business to attend to – and is confident about where he was born.</p>",Left,Right,X,Right
cde0745f-8830-46fe-963d-895a666d62d3,Father Of Muslim US Soldier Is Attorney Specializing In Selling US Citizenship,Donald Trump continues to be attacked by Gold Star families and some in the GOP for his comments to the father of a slain Muslim U.S. solider. Did he go too far?,"<p>Khizr Khan, who's son Humayun (L) was killed serving in the U.S. Army, speaks at the Democratic National Convention in Philadelphia, Pennsylvania, U.S. July 28, 2016. REUTERS/Lucy Nicholson</p> <p>Khizr Khan, the father of a fallen Muslim U.S. soldier, is an immigration attorney whose specialty is a program that critics say allows immigrants to buy their way in the United States.</p> <p>According to Khan’s website, he specializes in law related to the E-2 and EB-5 programs, which hands out green cards to foreign investors that put at least $500,000 into certain American firms. The investor can also get green cards for certain family members.</p> <p>Khan says he helps his clients buy real estate in the U.S. as well as start businesses.</p> <p>“The E-2 and EB-5 are two of the most notoriously abused visa categories that essentially allow wealthy foreigners to buy their way to U.S. residency, and possibly citizenship, with a relatively modest investment,” Jessica Vaughan, the policy director for the Center for Immigration Studies,” told The Washington Examiner.</p> <p>“The EB-5 is literally a ‘citizenship for sale’ program in which a visa for a whole can be bought for as little $500,000,” Vaughan told The Examiner. “It is literally a ‘citizenship for sale’ program, and it’s an amazing deal. Compared to other countries, America is the Walmart of investor visa programs,” she added.</p> <p>Khan criticized Donald Trump during the Democratic National Convention for the Republican presidential nominee’s stance on immigration from Muslim countries.</p> <p>“Have you even read the United States Constitution? I will gladly lend you my copy,” Khan said.</p> <p>The feud has lasted all weekend and into the new week.</p> <p>Follow Kerry on Twitter</p>",Left,Right,X,Right
d78a259b-534b-4b07-ab91-89ec624363b3,GOP tells Roy Moore to step down if allegations of teen sex are true,"Roy Moore, the highly conservative Republican candidate for Alabama's open Senate seat, has been accused of sexually assaulting a 14 year old when he was 32 years old.","<p>Washington Republicans moved quickly Thursday to try to oust their candidate in the Alabama Senate race, former state Chief Justice Roy Moore, after a newspaper reported he had enticed an underage girl into a sexual encounter decades ago.</p> <p>The Washington Post reported that a woman says Mr. Moore initiated the encounter in 1979, when she was 14 and he was 32. Three other women told the newspaper Mr. Moore pursued them when they were 16 to 18 years of age.</p> <p>That was the last straw for Republicans who’d already been at odds with Mr. Moore, their nominee, on a host of other issues.</p> <p>“The allegations against Roy Moore are deeply disturbing and disqualifying. He should immediately step aside and allow the people of Alabama to elect a candidate they can be proud of,” said Sen. John McCain, Arizona Republican.</p> <p>Others didn’t go that far but said if the allegations turn out to be true, Mr. Moore should step aside.</p> <p>Sen. Cory Gardner, chairman of the National Republican Senatorial Committee called the allegations “deeply troubling” and he and Senate Majority Leader Mitch McConnell both said Mr. Moore should drop out if there’s truth to the claims.</p> <p>SEE ALSO: Bannon attacks newspaper as ‘opposition party’ over report on Roy Moore</p> <p>“If that’s true, he wouldn’t belong in the Senate,” said Sen. Richard Shelby, Alabama Republican.</p> <p>Mr. Moore gave no indication he would accede to the demands and struck back at The Post on Twitter, saying they were his opponents in “a spiritual battle.”</p> <p>“The forces of evil will lie, cheat, steal — even inflict physical harm — if they believe it will silence and shut up Christian conservatives like you and me,” Mr. Moore told supporters, urging them to stay behind him.</p> <p>“Our children and grandchildren’s futures are on the line. So rest assured — I will NEVER GIVE UP the fight!” he tweeted.</p> <p>Mr. Moore’s campaign said if the allegations were true, they would have emerged in previous campaigns for governor or chief justice.</p> <p>Mr. Moore is running for the seat left vacant earlier this year when Jeff Sessions was tapped to be attorney general. Mr. Moore was the top vote-getter in the GOP primary and then won a runoff with Sen. Luther Strange, the man appointed to fill the seat between Mr. Sessions’ departure and the special election slated for Dec. 12.</p> <p>The national GOP establishment — including President Trump — had fought Mr. Moore’s nomination, backing Mr. Strange in the primary and runoff.</p> <p>But some conservative activists had rallied to the former state chief judge, arguing he was the most Trump-like candidate in the race.</p> <p>Stephen K. Bannon, Mr. Trump’s former chief strategist who’s now back at his post at Breitbart.com, was among those backing Mr. Moore. On Thursday, Breitbart called out The Post for its story, saying that the paper had endorsed Mr. Moore’s opponent in the special election, Democratic candidate Doug Jones, a former U.S. attorney.</p> <p>As chief judge, Mr. Moore gained national notoriety for defying orders that he remove a monument to the Ten Commandments from a judicial building.</p> <p>Mr. Moore’s allies earlier this fall had said national party groups weren’t doing their part to help Mr. Moore get election, even after he became the GOP’s nominee.</p> <p>That is unlikely to change now. The Senate Leadership Fund, a deep-pocketed political action committee with ties to Mr. McConnell, urged Alabama Republicans to find a way to remove Mr. Moore from the ballot.</p> <p>“There is no place in our party for sexual predators,” said SLF President Steven Law.</p>",Left,Right,X,Right
