docid,title,event,full_text,worker_1_label,worker_2_label,human_label,outlet_bias
633a12f3-1534-4e0d-9d6f-8254ddd83957,CBS fires vice president who said Vegas victims didn't deserve sympathy because country music fans 'often are Republican',"Many politicians, members of the media, and other public figures are offering condolences as well as opinions in the wake of the deadliest mass shooting in U.S. history that left at least 58 dead and 500 others injured in Las Vegas Sunday night. Many people on the Left are calling for stricter gun legislation and for Congress to act quickly in response to the shooting. Conversely, many on the Right are saying that the event should not be politicized until all information has been acquired and the dust has settled.","<p>CBS has parted ways with one of the company’s top lawyers after she said she was “not even sympathetic” to victims of the Las Vegas shooting because “country music fans often are Republican,” when discussing the mass shooting that unfolded in Las Vegas late Sunday night.</p> <p>Monday night she issued a statement of apology.</p> <p>Hayley Geftman-Gold, the network's now-former vice president and senior counsel, said, “Earlier today I posted an indefensible post in a Facebook discussion thread concerning the tragic Las Vegas shooting, a statement I sincerely regret. I am deeply sorry for diminishing the significance of every life affected by Stephen Paddock’s terrorism last night and for the pain my words have inflicted on the loved ones of the victims. My shameful comments do not reflect the beliefs of my former employer, colleagues, family, and friends. Nor do they reflect my actual beliefs — this senseless violence warrants the deepest empathy. I understand and accept all consequences that my words have incurred.”</p> <p>A CBS spokeswoman told Fox News that Geftman-Gold, “who was with us for approximately one year, violated the standards of our company and is no longer an employee of CBS. Her views as expressed on social media are deeply unacceptable to all of us at CBS. Our hearts go out to the victims in Las Vegas and their families.”</p> <p>Geftman-Gold took to Facebook after a gunman opened fire at the Route 91 Harvest Music Festival in Las Vegas, killing at least 59 people and sending more than 510 others to hospitals.</p> <p>“If they wouldn’t do anything when children were murdered I have no hope that Repugs [sic] will ever do the right thing,” Geftman-Gold wrote in a now-deleted message that was first reported and captured by The Daily Caller.</p> <p>Geftman-Gold continued: “I’m actually not even sympathetic bc [sic] country music fans often are Republican gun toters [sic].”</p> <p>Geftman-Gold is presumably referring to Sandy Hook, which occurred in Newtown, Conn. back in 2012. A 20-year-old gunman, Adam Lanza, killed 20 children and six adults during the tragic event that sparked intense political debates regarding gun control.</p> <p>Her attorney, Carrie A. Goldberg, responded: “In the last few hours my client, her family and friends have been bombarded by online death unimaginable in quantity and detail. We beg people to show love and support to survivors and loved ones — in Las Vegas and their own lives — instead of creating more violence.”</p> <p>Geftman-Gold did not work directly with the network’s news division. According to her LinkedIn bio, Geftman-Gold worked at CBS since September 2016 and graduated from the prestigious Columbia University law school in 2000.</p>",Left,Right,X,Right
63ee9840-3926-418c-ad22-f082dda49eb5,No One Wants the Latest Trumpcare Bill — Except Right-Wing Billionaires,"Senator John McCain announced today that he would vote no on the latest Obamacare repeal bill, also known as the Graham-Cassidy proposal. Many publications have noted that this likely means the bill is dead and will not move forward. McCain said in a statement that he, ""cannot in good conscience vote for the Graham-Cassidy proposal,"" as it had not gone through a bipartisan, rigorous debate process.","<p>Photo-Illustration: Photo-Illustration: Konstantin Sergeyev/Daily Intelligencer. Photos: Getty Images</p> <p>Senate Republicans know very little about what their new health-care plan would actually do. This is because the bill’s primary author left the Senate in 2006, and the legislation he wrote has been public for all of eight days. “If there was an oral exam on the contents of the proposal, graded on a generous curve, only two Republicans could pass it,” a senior Republican aide told a reporter this week — before stipulating that the bill’s putative co-author, Lindsey Graham, was not one of them.</p> <p>But you need not take an anonymous aide’s word on it. On Tuesday, Vox’s Jeff Stein asked nine GOP senators what problems the Graham-Cassidy health-care bill solves, and how it solves them. The lawmakers responded with platitudes about federalism, the phrase “read the bill and you’ll understand,” and a bizarre reference to the final scene of Thelma and Louise.</p> <p>Still, Republicans know a few things about their latest iteration of Trumpcare. They know that the bill reforms one-sixth of the American economy so radically the Congressional Budget Office will need weeks to generate a detailed analysis of its likely effects; that every major health-care-industry stakeholder — from doctors and patients and hospitals to insurers and medical charities — opposes the legislation; that seven of their own party’s governors also oppose it; that health-care-policy analysts believe the bill would make health insurance unaffordable for many people with preexisting conditions; that it would radically reduce Medicaid and federal subsidies for health insurance; and that some analysts say those cuts would increase the ranks of the uninsured by 32 million over the next decade.</p> <p>And yet, according to reports, at least 48 Republican senators are ready to vote for the bill next week. Which raises the question: Why is almost every GOP senator ready to vote for widely reviled legislation that they do not understand?</p> <p>The popular answer is that they feel a political obligation to make good on their promises to the conservative base, regardless of the implications for public policy. Remarkably, several senators have stated, explicitly, that this is their calculus.</p> <p>“You know, I could maybe give you ten reasons why this bill shouldn’t be considered,” Iowa’s Chuck Grassley told reporters in his state Wednesday. “But Republicans campaigned on this so often that you have a responsibility to carry out what you said in the campaign. That’s pretty much as much of a reason as the substance of the bill.”</p> <p>Senators are not supposed to support legislation that they believe to be unworthy of consideration on substantive grounds just because they promised their voters that they would support a bill of that general type. The entire point of having a republic — as opposed to a direct democracy — is that the former enables elected representatives to exercise independent judgement in policy-making.</p> <p>Still, as contemptible as Grassley’s official rationale for supporting Graham-Cassidy is, his party’s actual motivation for pushing the bill is (almost certainly) more sinister. In truth, Graham-Cassidy does not fulfill the Republican Party’s promises to its voters — and there is virtually no evidence that said voters would punish the party for failing to pass it. The bill does, however, advance the priorities of the GOP’s big-dollar donors — and there is significant evidence that they would punish the Republican lawmakers if the legislation fails.</p> <p>It’s true that Republicans have spent nearly a decade promising voters that they would “repeal and replace Obamacare.” But most Republicans specifically promised to replace the law with one that would make health-care benefits more generous and universally affordable. Our Republican president promised to preserve Medicaid in its current form and achieve universal coverage with lower deductibles. The mogul even went so far as to explicitly disavow the conservative movement’s traditional hostility to the welfare state, telling 60 Minutes, “There was a philosophy in some circles that if you can’t pay for it, you don’t get it. That’s not going to happen with us.”</p> <p>Trump wasn’t the only one singing such a tune. Virtually all of the GOP’s leading lights attacked Obamacare from the left, including Senate Majority Leader Mitch McConnell, who lamented in January, “There are 25 million Americans who aren’t covered now … And many Americans who actually did get insurance — when they did not have it before — have really bad insurance that they have to pay for, and the deductibles are so high that it’s really not worth much to them.”</p> <p>McConnell, Trump, and their co-partisans pretended to support a more generous government health program for a reason: That is what most Republican voters want. Earlier this year, a Morning Consult survey found that a majority of conservatives — and a large plurality of self-identified tea-party supporters — thought that “the government should spend more on health care.”</p> <p>Turns out Tea Party voters want more government healthcare spending, yet support Ryan's healthcare bill. Go figure. https://t.co/y77gXZHn6j pic.twitter.com/VT7W2FqDPC — Guy Kawasaki (@GuyKawasaki) March 23, 2017</p> <p>Those findings are consistent with polling from Pew Research, which back in May found 61 percent of Republican voters saying that government funding levels for health care should be maintained or increased. Meanwhile, according to a recent poll from the Kaiser Family Foundation, only 12 percent of all U.S. adults support cuts to Medicaid (which happens to be about the percentage of the public that supported the Senate’s previous Medicaid-gutting, Obamacare-repeal bill).</p> <p>Graham-Cassidy would cut federal spending on insurance subsides and the Medicaid expansion by an estimated $243 billion between 2020 and 2026. That is neither what Republicans campaigned on, nor what their constituents want.</p> <p>But it is what their most affluent donors want — or at least they believe it moves the ball in their desired direction. While Republican voters are broadly supportive of Medicaid — and many GOP senators from Medicaid-expansion states have touted their support for the policy — the conservative donor network funded by the oil billionaires Charles and David Koch has been unequivocal in its opposition to the federal program.</p> <p>“Our network voraciously opposed Medicaid expansion in state after state,” Tim Phillips, head of the Koch-funded nonprofit Americans for Prosperity, told GOP donors at the Koch Network’s June retreat. “These Republicans who expanded Medicaid were flatly wrong. So we’re going to continue holding these Republicans accountable.”</p> <p>At the same retreat, the Koch brothers themselves complained that the Republican health-care bill — which, at the time, already included significant cuts to Medicaid — was insufficiently conservative. That bill failed, amid widespread public opposition to its austerity. Senate Republicans responded by drafting a new iteration of Trumpcare that cuts Medicaid — and subsidies for health insurance — even more severely.</p> <p>In voting for Graham-Cassidy, Republican senators might fulfill promises they made to Charles Koch in Colorado Springs. But most would actually be breaking their promises to voters. Multiple GOP senators pledged to vote against any bill that failed to preserve protections for people with preexisting conditions, address the opioid crisis, or reduce insurance premiums.</p> <p>Graham-Cassidy fails to do all of these things. In fact, its scheme for block-granting federal health-care spending to the states is so haphazard and ill-thought-out, it would lead insurers to drastically increase their premiums, so as to protect themselves against market uncertainty.</p> <p>The notion that Republicans need to pass a bill that will increase the cost of health insurance — and break a variety of substantive promises to their constituents — for the sake of political expediency is bizarre. The only evidence for this view is that Republican voters still support “Obamacare repeal.” But if GOP lawmakers want to vote for a health-care bill that breaks their substantive promises to voters — and call it “Obamacare repeal” — they have better options.</p> <p>Days ago, Senate Democrats offered to support waivers that would allow red states to opt out of some Obamacare regulations, in exchange for funding to shore up the exchanges. This legislation would have averted a significant spike in insurance premiums next year — and, in keeping federal funding for health-care constant, it would have been closer to the substantive wishes of GOP voters than Graham-Cassidy is. What’s more, some Democrats were prepared to let President Trump call the measure “Obamacare repeal.”</p> <p>There is no reason to believe that the GOP’s political interests would be better served by passing a radical bill that will increase health-insurance premiums than by passing a bipartisan one that will reduce them — unless one stipulates that doing the latter would alienate big-dollar donors. Trump voters overwhelmingly approved of the president’s bipartisan debt-ceiling deal — and independents appear to have been even more enthusiastic.</p> <p>The GOP base is not allergic to bipartisanship and compromise, so long as it’s their champion who’s making the deals. But the Koch brothers are. The Kochs do not oppose Obamacare because the program doesn’t work well enough — they oppose it because they find it morally wrong for the state to take money from wealthy people and use it to subsidize health insurance for non-wealthy people. Thus, technocratic fixes that make government-subsidized health care work better are antithetical to their project. Their interest is not in improving the Affordable Care Act, but in discrediting the premise on which it is based: that redistributive government programs can improve health care for most Americans.</p> <p>And the Kochs and their ilk have made clear that Republicans who buck them will face consequences. This week, NBC News’ Kasie Hunt tweeted, “Republicans heard loud & clear from donors this August that do-nothing isn’t going to cut it.” At the Koch retreat in June, at least one major donor threatened to close “the Dallas piggy bank” until repeal was passed. In August, one Republican donor responded to the apparent death of Obamacare repeal by actually suing the party for fraud.</p> <p>Republicans don’t need donations from billionaires more than they need the votes of their base. But the former pay far closer attention to the details of policy. On fiscal matters, it is much riskier for Republicans to buck their donors than to betray the constituents who elected them.</p> <p>Senate Republicans are on the cusp of radically reforming our health-care system in ways that they do not fully understand — and that industry stakeholders and GOP voters broadly oppose — out of fear that a few dozen obscenely wealthy libertarians will evict them from Congress if they don’t.</p> <p>If Graham-Cassidy becomes law, our nation will enter a health-care crisis. But the fact that 40-something senators would vote for the bill, today, means that we have already entered a democratic one.</p>",Left,Right,X,Left
720e2402-f3d2-49f4-875d-c33e73ad2ff0,Eric Fehrnstrom Defends Paul Ryan's Misleading Assertions In Convention Speech,Ryan RNC Speech,"<p>TAMPA, Fla. -- Rep. Paul Ryan's (R-Wis.) much-anticipated speech Wednesday night had the usual bromides and warm, biographical details typically found in remarks at political conventions.</p> <p>It also had several demonstrably misleading assertions.</p> <p>For example, Ryan said that while campaigning for president in 2008, Barack Obama said a General Motors plant in Janesville, Wis., would not shut down.</p> <p>""That plant didn’t last another year. It is locked up and empty to this day. And that’s how it is in so many towns today, where the recovery that was promised is nowhere in sight,"" Ryan said.</p> <p>The plant did end up closing -- in December 2008. When George W. Bush was president. The decision to close the plant was made in June 2008.</p> <p>Eric Fehrnstrom, a senior adviser to Mitt Romney's campaign, defended the vice presidential candidate's remarks in an interview with CNN's ""Starting Point"" on Tuesday.</p> <p>""[H]e didn’t talk about Obama closing the plant, he said candidate Obama went there in 2008 and what he said was with government assistance, we can keep this plant open for another 100 years,"" argued Fehrnstrom. ""Here are we are four years into his administration; that plant is still closed. I think it's a symbol of the recovery that hasn't materialized for the people of Janesville, Wis., just as it hasn't materialized for Americans everywhere.""</p> <p>When Obama visited the plant in February 2008, he said, ""I believe if our government is there to support you, and give you the assistance you need to retool and make this transition, that this plant will be here for another hundred years.""</p> <p>Ryan also has shifted his rhetoric slightly when talking about the GM plant, allowing him to mince his words while arguing that he's not technically inaccurate.</p> <p>Earlier this month, Ryan was a bit less careful, saying, ""I remember President Obama visiting it when he was first running, saying he'll keep that plant open. One more broken promise.""</p> <p>CNN John Berman also asked Fehrnstrom on Thursday why Ryan blasted Obama for the failure of the Simpson-Bowles debt commission -- when the congressman was one of the Republicans who voted against the commission's recommendations.</p> <p>""He created a bipartisan debt commission,"" said Ryan in his speech Wednesday. ""They came back with an urgent report. He thanked them, sent them on their way, and then did exactly nothing. Republicans stepped up with good-faith reforms and solutions equal to the problems. How did the president respond? By doing nothing -- nothing except to dodge and demagogue the issue.""</p> <p>""[Ryan] stood in the way of the Simpson-Bowles deficit commission, and then criticized the president for not taking action on it,"" noted Berman.</p> <p>Fehrnstrom argued that the point was irrelevant, since Ryan later put out his own budget plan.</p> <p>""There can be disagreements about how to reduce the deficit and how to put the budget on a path to fiscal balance. The important thing is, what is your plan? He brought it forward,"" replied Fehrnstrom.</p> <p>Watch the full video below:</p>",Right,Left,X,Left
7343404d-205b-4d33-8563-717a972c1c18,Rubio Attacked Trump For Running a ‘Fake School.’ But There’s Just One Problem.,Rubio Unleashes On Trump,"<p>At the latest GOP presidential debate in Houston, Florida Sen. Marco Rubio attacked frontrunner Donald Trump over his for-profit school that’s been accused of scamming students. But Rubio doesn’t have much ground to stand on when it comes to criticizing for-profit colleges.</p> <p>So-called Trump University began operating in 2005, though it did not have an actual campus or offer actual degrees. Instead, it sold expensive CDs and DVDs and offered seminars promising students would learn how to make money in real estate. Students of Trump’s “university” are now pursuing a civil lawsuit accusing Trump University of fraud. The trial could begin sometime in May.</p> <p>At Thursday’s debate, Rubio slammed Trump University for being a “fake school” that only left students with a “cardboard cutout of Donald Trump.”</p> <p>“There are people that borrowed $36,000 to go to Trump University and they are suing him now,” Rubio said.</p> <p>Although students paid thousands of dollars for Trump seminars, Rubio’s hands are not clean either, since he has supported a for-profit college chain that has hurt far more students than Trump University has. Corinthian Colleges, which actually offered degrees and was regionally accredited, damaged far more students’ lives.</p> <p>Although 80,000 people attended Trump University’s free introductory seminars, only 9,200 paid the $1,495 for three-day seminars and as few as 800 people paid thousands of dollars for the university’s mentorship and workshop packages, according to the Washington Post. But as many as 350,000 students who borrowed to attend Corinthian Colleges’ schools could benefit from student loan forgiveness from the federal government for being victims of fraud from the college chain.</p> <p>Instead of encouraging the government to investigate the for-profit college chain, Rubio asked for leniency in a letter to the U.S. Department of Education in the summer of 2014. The letter, which was obtained by Bloomberg Politics, read, in part, “While I commend the Department’s desire to protect our nation’s students from fraudulent and malicious activity by any institution of higher education, regardless of tax status, I believe the Department can and should demonstrate leniency as long as Corinthian Colleges, Inc. continues to expeditiously and earnestly cooperate by providing the documents requested.”</p> <p>Rubio has also accepted $27,600 in contributions from Corinthian Colleges throughout the past five years, Bloomberg reported. The last donation for $2,700 was filed on April 30 of last year.</p> <p>Last year, Corinthian Colleges shut down its remaining 28 campuses, leaving 16,000 students without a college, shortly after the Department of Education fined the company $30 million for falsifying job-placement rates. For example, a student whose field of study was accounting was counted as having found a job in her field when in reality she was doing food service at Taco Bell.</p> <p>In an interview with ThinkProgress last fall, Jessica King, a 33-year-old single mother who attended Everest College and now works as a bartender, said she doesn’t think continuing her education is possible due to over $30,000 in debt she’s still paying off. “At this point, I’d love to be able to go back to school and get a degree and my finish up my hopes and my dreams, but I think Everest robbed me of that but the department of education robbed me of that,” King said.</p>",Right,Left,X,Left
73c65e26-8e72-4ce4-973e-6b2a95f4a72d,"Khan Family Feud, ‘We Want To Be Out Of This Controversy’",Donald Trump continues to be attacked by Gold Star families and some in the GOP for his comments to the father of a slain Muslim U.S. solider. Did he go too far?,"<p>The embattled parents of the fallen Sergeant Khan want to get away from the feud that started when they attacked Republican nominee Donald Trump on the stage of the Democratic National Convention (DNC) last week.</p> <p>“We want to be out of this controversy. That is not our style…This is not our path,” father Khizr Khan told CNN Monday. Khan attempted to preempt any Trump response by saying there was no need for Trump to comment any more on the matter. “We want to maintain our dignity,” Khan added.</p> <p>Trump responded to Khan on Twitter.</p> <p>Mr. Khan, who does not know me, viciously attacked me from the stage of the DNC and is now all over T.V. doing the same – Nice! — Donald J. Trump (@realDonaldTrump) August 1, 2016</p> <p>Trump immediately attempted to shift the narrative to terrorism in his next tweet.</p> <p>This story is not about Mr. Khan, who is all over the place doing interviews, but rather RADICAL ISLAMIC TERRORISM and the U.S. Get smart! — Donald J. Trump (@realDonaldTrump) August 1, 2016</p> <p>The Khan family used their time at the DNC to attack Trump for his comments on Muslims in America, and to give him a lesson on the Constitution. Khizr Khan also said that Trump has never had to make the sacrifices that people like his son do on a day-to-day basis.</p> <p>Trump responded the next day in an interview on ABC, saying, “I think I’ve made a lot of sacrifices. I work very, very hard.” Trump went on to insist that Khan’s wife didn’t speak at the DNC because of her Islamic faith. “If you look at his wife, she was standing there. She had nothing to say. She probably, maybe she wasn’t allowed to have anything to say. You tell me.”</p> <p>Republican leadership refused to defend Trump’s attacks on the Khan family. Speaker of the House Paul Ryan made an official statement on the matter, saying, “America’s greatness is built on the principles of liberty and preserved by the men and women who wear the uniform to defend it. As I have said on numerous occasions, a religious test for entering our country is not reflective of these fundamental values. I reject it.”</p> <p>Senate Majority Leader Mitch McConnell, former Governors Jeb Bush and Scott Walker, all came out against Trump’s statements, and affirmed the respect they have for families of fallen soldiers. Vice Presidential nominee Mike Pence was apologetic for any unintended offense.</p> <p>Follow Phillip On Twitter</p> <p>Have a Tip? Let us Know</p> <p>Content created by The Daily Caller News Foundation is available without charge to any eligible news publisher that can provide a large audience. For licensing opportunities of our original content, please contact [email protected].</p>",Left,Right,X,Right
