docid,title,snippet1,snippet2,snippet3,Q1_score,Q2_score,Q3_reason,other_text,ManualBiasLabel,outletLabel,Correct
c5b2834c-8357-4ef8-989a-5114ea6eb6ce,"Haley: ‘Yes,’ We Had To Twist Arms To Get China, Russia On Board With North Korea Sanctions","U.S. ambassador to the United Nations Nikki Haley speaks while Japan's U.N. Ambassador Koro Bessho (R) and South Korea's U.N. Ambassador Cho Tae-yul (L) look on during a press encounter ahead of an emergency meeting of the U.N. Security Council at the United Nations in New York, U.S., May 16, 2017. REUTERS/Brendan McDermid TPX IMAGES OF THE DAY",U.S. Ambassador to the U.N. Nikki Haley revealed Monday that the U.S. had to twist China and Russia’s arms to get them on board with the new sanctions on North Korea.,"Content created by The Daily Caller News Foundation is available without charge to any eligible news publisher that can provide a large audience. For licensing opportunities of our original content, please contact [email protected].",-2.5,2.5,"[""0"",""5""]",,Right,Right,True
e4075bda-200c-4d92-8769-57ea618cdd77,Trump: North Korea Threats Will Be ‘Met With Fire And Fury’,"President Donald Trump issued a powerful warning to North Korea Tuesday, threatening to unleash an unprecedented assault on the rogue regime.","“North Korea best not make any more threats to the United States,” Trump declared before the White House press pool. “They will be met with the fire and fury like the world has never seen. He has been very threatening beyond a normal state, and as I said, they will be met with the fire and fury and, frankly, power the likes of which this world has never seen before.”","Content created by The Daily Caller News Foundation is available without charge to any eligible news publisher that can provide a large audience. For licensing opportunities of our original content, please contact [email protected].",-5.0,2.5,"[""0"",""5""]",,Right,Right,True
5a271725-f56f-454c-9a97-8bec34b4af9e,Trump To North Korea: Keep Rattling That Saber And Feel America’s ‘Fire And Fury’,"Well, I didn’t want to live forever anyway. If we’re gonna go out, might as well go out in a blaze of glory.","I’m not much of a Trump fan, but as a neocon, naturally I’m a racist warmonger. So I’m fine with the President of the United States openly threatening North Korea. CBS News:",MAGA!,-2.5,2.5,"[""5"",""3""]",,Left,Right,False
7818081c-dbfc-4a6c-ad4d-fcae8a0861bf,North Korea Has Entered An Exclusive Nuclear Club That Has The World Reeling,"The intercontinental ballistic missile Hwasong-14 is seen during its test in this undated photo released by North Korea's Korean Central News Agency (KCNA) in Pyongyang, July 5 2017. KCNA/via REUTERS","North Korea has developed a nuclear warhead for its new intercontinental ballistic missile, a confidential defense intelligence assessment revealed.","Content created by The Daily Caller News Foundation is available without charge to any eligible news publisher that can provide a large audience. For licensing opportunities of our original content, please contact [email protected].",5.0,0.0,"[""5"",""4""]",,Center,Right,False
2e7c871c-54a8-424d-931a-199a7e5c6070,Nikki Haley calls leaks ‘incredibly dangerous’ to American lives,U.S. Ambassador to the United Nations Nikki Haley said Tuesday the continued leaks are “incredibly dangerous” and put American lives in danger.,"“I don’t know what’s going on, but I will tell you it’s incredibly dangerous. You’re not just getting a scoop on something, you’re playing with people’s lives, and this has got to stop wherever the leaks are coming from,” Ms. Haley said on Fox News.","Copyright © 2018 The Washington Times, LLC. Click here for reprint permission.",-2.5,-2.5,"[""5"",""3""]",,Right,Right,True
a03c0be1-df35-474f-b5b1-908c1ddbd8c2,Trump: North Korea 'will be met with fire and fury like the world has never seen' if more threats emerge,"President Donald Trump responded to reports of North Korea's nuclear threats on Tuesday, saying the regime ""will be met with fire, fury and frankly power, the likes of which the world has never seen before.""","Speaking from New Jersey, Trump also said North Korean leader Kim Jong Un ""has been very threatening beyond a normal state,"" adding that the regime ""best not make any more threats to the United States.""","But the U.S. on Saturday achieved what appeared to be a remarkable diplomatic victory, securing the unanimous approval of tough new sanctions -- including votes from Russia and China.",2.5,2.5,"[""0"",""5""]",,Right,Right,True
12a2cac7-29e3-4c16-af08-44d81096949d,"Woman Wins Election, Democrats Outraged","Republican candidate Karen Handel for Georgia's 6th Congressional District special election talks to supporters during a campaign stop at Santino's Italian Restaurant & Pizzeria in Alpharetta, Georgia, April 17, 2017. There is a special election tomorrow to fill that seat, which opened after Republican Tom Price was appointed as secretary of Health and Human Services. REUTERS/Kevin D. Liles","Jon Ossoff raised millions of dollars from people who couldn’t vote for him. He couldn’t even vote for himself. In retrospect, maybe that was a problem.",Almost!,2.5,-5.0,"[""5"",""4""]",,Right,Right,True
06851ed2-6ee5-4715-9d81-e8b522b864d8,Nancy Pelosi Didn’t Cost Jon Ossoff the Election,Photo: CLFSuperPAC/YouTube,"On Tuesday night, a 30-year-old Democrat with no electoral experience narrowly lost a special election in a deep red congressional district that he doesn’t live in.","But if that future has yet to arrive, Democrats shouldn’t pretend that it has for the sake of appealing to people who hate their party’s base.",2.5,-5.0,"[""5"",""3""]",,Left,Left,True
47b1cbef-e1b0-46ef-903f-c8c86cac968f,"After Ossoff Defeat, Dems Start To Second Guess 2018 Prospects",Jon Ossoff addresses his supporters after his defeat in Georgia's 6th Congressional District special election in Atlanta. (REUTERS/Chris Aluka Berry),Members of the Democratic party are changing their tune after former Democratic congressional contender Jon Ossoff was defeated by Republican Karen Handel in the special election for Georgia’s sixth district Tuesday.,"Content created by The Daily Caller News Foundation is available without charge to any eligible news publisher that can provide a large audience. For licensing opportunities of our original content, please contact [email protected].",2.5,-5.0,"[""5"",""3""]",,Right,Right,True
7ec0a751-097c-4862-9ebb-dec241a2431a,This Might Be the Worst Democratic Freak-out Ever,Photo: Joe Raedle/Getty Images,"Karen Handel’s close-but-not-that-close win in Georgia’s sixth district, the fourth Republican victory in four special elections, has officially made the party’s failure to capture a House seat in 2017 a capital-T Thing. “Let’s be clear: something ain’t working for Democrats, party insiders privately tell us,” reports Politico Playbook. Representative Ro Khanna, sounding like an upset fan calling into a sports talk radio show, called for the party to “fire its consultants” and replace them with three of his favorite opinion journalists. “Deep down [Democrats] know they needed – and still need – a win in a high-profile race in which the fight was between Trump/Republicans and Pelosi/Democrats,” writes Chris Cillizza. “There are no moral victories in politics. No matter what the losing side says — and they always say this — the only thing that really matters when it comes to special elections is the ‘W’ and the ‘L.’”","But perhaps the better response is to take irrationality for granted, and start to act … rational?",5.0,-5.0,"[""0"",""5""]",,Left,Left,True
091773c9-9457-4534-b764-d19057a39204,0-4 and an About-Face: Democrats Suddenly Believe Ossoff No Longer Matters,"He was a candidate on whom it would be worth risking millions. He was a messianic, baby-faced neophyte slated to stage a Macron-esque takeover of Georgia’s sixth congressional district in the #Resistance’s first great blow to Trump’s America. CNN’s Don Lemon even likened him to Barack Obama.","Jon Ossoff was supposed to be a vessel for the categorical repudiation of the Trump administration, but alas, as the president gleefully noted this morning, the Democrats marked two new entries in a growing line of losing streaks in special elections framed by some in the media as referendums on one of the most unpopular presidents in modern American history.","With taxpayer-subsidized Planned Parenthood dumping nearly $735,000 into Ossoff’s campaign and the DCCC pouring in over $5 million, Republicans turned out to vote in record numbers. Ultimately, for Georgia voters the election was less of a referendum on Trump than a rejection of an untried carpetbagger.",0.0,0.0,"[""5"",""4""]",,Right,Right,True
0b2f7734-6169-4ac7-a84e-e09e4f87861b,Georgia race: Trump casts GOP winning streak as rejection of Dem ‘obstruction’,"President Trump and his allies cheered Republican Karen Handel's victory Tuesday in the closely watched Georgia runoff as a clear endorsement of the administration's agenda -- and cast Democrats' special election losing streak as a rebuke of the party's ""obstruction"" tactics.","“Democrats would do much better as a party if they got together with Republicans on Health Care, Tax Cuts, Security. Obstruction doesn’t work!” Trump tweeted.","She added: ""Laughing my #Ossoff.""",-5.0,-5.0,"[""0"",""5""]",,Right,Right,True
ca53fb37-3315-4821-81b5-0f91c5c805e6,Kellyanne Takes A Victory Lap After Ossoff Defeat,"Kellyanne Conway, campaign manager and incoming counselor to the president, exits Trump Tower in New York, U.S. November 16, 2016. REUTERS/Eduardo Munoz",White House counselor Kellyanne Conway took a victory lap on Twitter after Republican Karen Handel defeated Democrat Jon Ossoff in the special election for Georgia’s Sixth District.,"Conway took a third shot at Ossoff while congratulating Handel on her victory. The White House counselor thanked Handel for “for standing strong, for running on issues, for being a grownup and for living in the district” — taking a backhanded swipe at Ossoff, who didn’t live in the district he was hoping to represent.",2.5,2.5,"[""5"",""4""]",,Right,Right,True
66a204f7-2e58-4f9b-a582-ddf603d34e5f,"Planned Parenthood spent $734,000 in failed Georgia race",Jon Ossoff lost the House race in Georgia’s 6th Congressional District despite receiving nearly three-quarters of $1 million from the Planned Parenthood Action Fund.,"With $734,000 in campaign contributions, the abortion giant’s Action Fund was the second-biggest spender on the Democratic side of the ledger — only trailing the Democratic Congressional Campaign Committee, which poured $4.9 million into the race, according to figures from the Federal Election Commission.","Copyright © 2018 The Washington Times, LLC. Click here for reprint permission.",-2.5,5.0,"[""1"",""5""]",,Right,Right,True
a67eb9b6-aeda-4688-b571-19d4a0877d78,Ossoff & Handel: Planned Parenthood Spending Falls Short,"It’s difficult to determine who ended up as the biggest loser in yesterday’s special election in Georgia’s sixth district. The most obvious choice is Democratic candidate Jon Ossoff, who, despite raising an historic $23 million in campaign funding, could not bring home the victory for his party last night.",The Democratic party itself was another dud in Georgia’s sixth. After months of spinning this race as an entirely winnable one — and a referendum on the early days of Donald Trump’s presidency — the party and its advocates are once again being forced to reexamine their strategies and their appeal to American voters.,"If money is really so tight over at Planned Parenthood — and if American women are truly in desperate need of life-saving care that they can’t get anywhere else — perhaps the abortion-rights group should think twice before dropping hundreds of thousands on insignificant political races, whether or not those races end in bitter defeat.",2.5,-5.0,"[""6""]",,Right,Right,True
8f3e3f29-baae-4a70-97a6-62b8e5c42f72,Karen Handel’s Win & Donald Trump -- Jon Ossoff’s Loss,"Karen Handel, the Republican, won. Who among us can contain his excitement?","It’s also a win for Donald Trump for one simple and obvious reason: because the alternative would have been so much worse for him. If Handel had lost, it would have hardened the media narrative that Republicans are fleeing the president (note: I said narrative, not fiction. The man is at 72 percent among Republicans, but that’s down eleven points in two months). A Handel loss would probably have led to actual politicians fleeing the president. Meanwhile, if Ossoff had won, Democrats would have been even more emboldened. They could go to donors and say, “We bought a seat in a Republican district with a hipster doofus candidate, who got trolled into getting engaged. If we do it 23 more times, we get a Democratic House, a Speaker Pelosi, and maybe impeachment.”","*Correction: Perhaps due to the Venti Irish whiskey the author consumed, he mis-characterized the cost of a large coffee from Starbucks. He should have written $2.89. He regrets the error, but not the whiskey.",-2.5,0.0,"[""6""]",,Right,Right,True
f0b67bb1-65cc-4126-ae05-c529e646d8ff,Trump: 'Really surprised' by Ryan holding back endorsement,"Donald Trump said Friday he was “really surprised” by House Speaker Paul Ryan declining to endorse him, telling Fox News he has brought “millions” into the party and is getting endorsements “left and right” – except from Ryan.","Despite the presumptive Republican nominee’s claims, he still faces resistance from some senior GOP figures, including Ryan’s 2012 running mate Mitt Romney, a vocal Trump critic who plans to skip the July convention.",A spokesman later clarified that Trump plans to pick a Republican.,-2.5,0.0,"[""6""]",,Right,Right,True
a5e4f7dd-8737-4b30-8f1a-fd7bb08aef9e,This Taco Bowl Is What Donald Trump Is Offering As Hispanic Outreach ,"If a taco bowl is presumptive Republican presidential nominee Donald Trump’s way of reaching out to the Hispanic community, he might want to rethink his strategy.","Trump, who has focused much of this election cycle on making inflammatory remarks about Latino immigrants, declared his love for Cinco de Mayo with a taco bowl at his namesake building in New York City on Thursday.","Trump isn’t the only Republican to miss the mark on Hispanic outreach. For the past three years, the Republican National Committee has celebrated Hispanic Heritage Month by ignoring the topic of immigration reform. And in this year’s Cinco de Mayo message, the RNC omitted last year’s call for a “welcoming country.”",2.5,-5.0,"[""0"",""5""]",,Left,Left,True
a5c19641-f21a-4898-bb72-1819660fe155,Donald Trump Eats Taco Bowl To Prove He Really Loves Hispanics,"U.S. Republican presidential candidate Donald Trump speaks during a campaign rally at the Allen County War Memorial Coliseum in Fort Wayne, Indiana, U.S., May 1, 2016. REUTERS/Kamil Krzaczynski","Republican presidential candidate Donald Trump tweeted a picture of himself eating a taco bowl Thursday, making sure to let the world know he loves Hispanics and wishes them all a happy Cinco de Mayo.","Content created by The Daily Caller News Foundation is available without charge to any eligible news publisher that can provide a large audience. For licensing opportunities of our original content, please contact [email protected].",5.0,5.0,"[""1"",""5""]",,Right,Right,True
156fd702-89d5-47b6-b18b-9ffe174e5494,"Vicente Fox, former Mexican president, apologizes to Donald Trump for border wall outburst",Former Mexican President Vicente Fox on Wednesday invited Donald Trump to visit the country and apologized for using brash language when he criticized the presumptive Republican presidential nominee’s border wall plan nearly two months ago.,"Mr. Fox, who served as Mexico’s president from 2000 to 2006, has slammed Mr. Trump as “ignorant” and “crazy” for his proposal to get Mexico to foot the bill for the border wall. Speaking to Fusion’s Jorge Ramos in February, Mr. Fox said, “I’m not going to pay for that f–—g wall.","Copyright © 2018 The Washington Times, LLC. Click here for reprint permission.",-2.5,-5.0,"[""5"",""4""]",,Center,Right,False
99e3faef-dfb7-479e-91f8-78b8efdc8f33,Paul Ryan Is Not Ready to Endorse Donald Trump,The speaker of the House is not on board the Trump Train:,"Speaker Paul D. Ryan, the nation’s highest-ranking elected Republican, said Thursday he was “not ready” to endorse Donald J. Trump, the presumptive Republican nominee. Mr. Ryan, who is also chairman of the Republican National Convention, has repeatedly said he would support his party’s nominee. But he has carved out some terrain to differentiate himself, by insisting that House Republicans write their own policy agenda this year and by giving speeches that at times criticized Mr. Trump’s views. Mr. Ryan said Republicans needed a “standard-bearer” who embodied the party’s standards. “I don’t want to underplay what he accomplished,” Mr. Ryan said about Mr. Trump. But he added, “We hope that our nominee aspires to be Lincoln and Reaganesque,” someone who “appeals to a vast majority of Americans.” “I think conservatives want to know does he share our values and our principles,” he said. “There’s a lot of questions conservatives are going to want answers to.”","Ryan is right to break with Senator Mitch McConnell, who said this week that he “remained committed to supporting the nominee chosen by Republican voters.” GOP leaders possess free will and a conscience, they should exercise that will to preserve the intellectual and moral integrity of the conservative movement. Come join us in Never Trump, Mister Speaker. Spend your energy preserving the House and rebuilding the conservative movement. Every minute spent on the deck of the USS Trump is another minute spent hurtling straight into the political icebergs.",-2.5,0.0,"[""5"",""3""]",,Left,Right,False
f58e6931-386f-4dfd-b007-3a0871201c79,Donald Trump may be only pro-life option left,"While some conservatives are already questioning whether to support presumptive Republican presidential nominee Donald Trump in the general election, several prominent pro-life groups say he’s the only viable option for abortion opponents in 2016.",Between Mr. Trump and likely Democratic presidential nominee Hillary Clinton — the only presidential candidate ever endorsed by Planned Parenthood — Father Frank Pavone says the decision is easy.,"Copyright © 2018 The Washington Times, LLC. Click here for reprint permission.",2.5,-2.5,"[""5"",""4""]",,Right,Right,True
66ddbca9-d303-41e3-8480-b389b86e9d57,There Aren’t Enough White Dudes in America to Elect Donald Trump President,Photo: John Moore/2016 Getty Images,"It’s not a secret that Donald Trump is not very, and is not likely ever to become, popular among minority voters. He’s also given women a lot of reasons to dislike him for his porcine ways, and they have reciprocated with some terrible favorable/unfavorable ratings. A recent ABC News–Washington Post survey showed Trump at 29/68 among white women, a demographic group that only one Democrat (Bill Clinton in 1996) has carried since the 1960s.","No, Trump’s not going to carry all of the white men in America, particularly since he strikes many of the younger bros as a cartoon-villain representation of everything they dislike and fear about the baby-boom generation. So he’d be wise to explore ways to kiss and make up with the majority of Americans he’s disrespected.",-2.5,2.5,"[""5"",""3""]",,Left,Left,True
565c7a2e-fea2-44df-9fbd-0c7ec94b6972,Trump to Fundraise with the RNC -- Hypocrite,"Per the Wall Street Journal, Trump’s self-financing days are over:","Facing a prospective tab of more than $1 billion to finance a general-election run for the White House, Donald Trump reversed course Wednesday and said he would actively raise money to ensure his campaign has the resources to compete with Hillary Clinton’s fundraising juggernaut. His campaign also is beginning to work with the Republican National Committee to set up a joint fundraising committee after his last two rivals—Texas Sen. Ted Cruz and Ohio Gov. John Kasich—dropped out in the wake of Mr. Trump’s resounding Indiana win on Tuesday.","And yet Trump is here promising to raise money from precisely the same people he has previously described as the problem — not only from the “elite” private interests, but alongside the RNC itself. Are we really to believe that the Money Corrupts! claim obtains only during the primaries, victory in which affords a candidate no actual power, but not during the general, which delivers to the victor the most powerful office in the land?",-2.5,0.0,"[""5"",""4""]",,Left,Right,False
eb344d33-63dc-4df8-8909-0c9bcf8454ff,Obama: GOP trying to ‘plunge this country back into a recession’,"After a disagreeable phone call with Speaker John A. Boehner on the budget impasse, President Obama Saturday accused House Republicans of trying to “plunge this country back into a recession” in their battle with the president over Obamacare.","In his weekly address, Mr. Obama blamed the gridlock on “a faction on the far right of the Republican party who’ve convinced their leadership to threaten a government shutdown if they can’t shut off the Affordable Care Act.”","“We could fix it tomorrow,” Mr. Obama said. “Both houses of Congress can take a simple vote to pay our bills on time, then work together to pass a budget on time.”",2.5,-5.0,"[""1"",""5""]",,Left,Right,False
48644e02-fb8c-4fdb-b071-0fd2743bc477,Explainer: Why do some conservatives think they can defund ObamaCare?,"Most astute political observers see the effort to defund ObamaCare as, at best, a quixotic pursuit. So why are so many grassroots conservatives convinced it’ll work?","That’s the question I seek to answer in my latest column for The Guardian, where I lay out the 7 “unreasons” why some conservatives believe this to be a possible and prudent strategy.",Read the whole thing here.,2.5,2.5,"[""5"",""3""]",,Left,Right,False
e3fd55dc-4ec9-4e65-8a0d-22b4114ec091,Vote To Defund Obamacare Primes Showdown Over Shutdown,"WASHINGTON -- Ignoring the wishes of the White House and the Senate, the House of Representatives passed a stopgap funding bill Friday that will shut down the government unless Democrats agree to defund President Barack Obama's marquee health care law.","While the House voted 230 to 189 to pass the measure that Democrats have called unacceptable, Republicans insisted their bill does nothing to shutter the federal government.",This story has been updated with the names of those House lawmakers who did not vote with their party on the stopgap funding bill.,-5.0,-5.0,"[""0"",""5""]",,Right,Left,False
45bb966d-3fdb-4c58-873a-9ec113531f94,Red State Democrats Oppose Republican Effort To Defund Obamacare,"WASHINGTON -- While pushing an effort to defund Obamacare or risk a government shutdown, congressional Republicans have insisted they might have some unlikely allies on their side: Senate Democrats up for reelection in red states.","But at least two of those Democrats, Sens. Mark Begich (Alaska) and Mark Pryor (Ark.), laughed off the suggestion Thursday that they would vote for a continuing resolution that permanently strips the Affordable Care Act of its funding.","Correction: This story has been corrected to reflect that Sadie Weiner is a spokeswoman for Sen. Kay Hagan, not Sen. Mary Landrieu, and to clarify Hagan's position on a continuing resolution that defunds Obamacare.",5.0,-5.0,"[""5"",""4""]",,Right,Left,False
9f201984-65cd-42ab-b0ef-1df79f786d6a,House Democrats: Tea Party Has Officially Overthrown GOP Leaders,"WASHINGTON -- House Democrats have grown accustomed to the Republican majority passing legislation that won't stand a chance in the Senate, let alone make it to President Barack Obama's desk. But as the lower chamber prepares to vote Friday on a continuing budget resolution that defunds Obamacare, Democrats are declaring an official takeover of the House GOP by its tea party faction.","House Minority Leader Nancy Pelosi (D-Calif.) told reporters on Capitol Hill Thursday that she no longer likes to use the term ""Republicans.""","""That's the frustrating part -- there are a majority of votes in our chamber to pass legislation in all of these areas, but unless these bills are brought to the floor, we can't vote on them,"" Cicilline said. ""It's fundamentally anti-Democratic.""",5.0,-2.5,"[""5"",""4""]",,Left,Left,True
c8643b2d-a963-4e17-be5c-f3afd54aa4bd,The Obamacare circular firing squad,"“Nancy Pelosi is more well-liked around here,” an anonymous Republican aide bitched to National Review about Ted Cruz.","“In the United States Senate, we will not repeal or defund Obamacare. We will not. And to think we can is not rational,” John McCain told CNN.","Ever since Newt Gingrich became speaker, Republicans have developed a knack for making fiscal responsibility look irresponsible. The federal government currently piles up as much debt in a decade as it once took 200 years to amass. It took until 1987 for the federal budget to reach $1 trillion and until 1998 for the national debt to reach $5 trillion. The debt ceiling was $2.3 trillion in 1980, a number that would tank Washington’s credit rating today.",-2.5,2.5,"[""5"",""3""]",,Left,Right,False
