docid,title,event,full_text,human_label,outlet_bias
01dbbdbe-e1ed-4a8e-8f52-a1cc3a8765be,Donald Trump hits Russia with new sanctions for election meddling,"The U.S. will impose new economic sanctions on two-dozen Russian individuals and entities for cyberattacks in the U.S. and meddling in the 2016 election, senior national security officials said Thursday.","<p>The Trump administration slapped sanctions on two dozen Russian individuals and spy agencies Thursday, officially blaming them for meddling in the 2016 U.S. presidential election, as the U.S. government joined its top European allies in blaming the Kremlin for a nerve gas assassination attempt on a former Russian spy in Britain this month.</p> <p>Among those targeted for the sanctions were 13 Russian nationals and three organizations already indicted in special counsel Robert Mueller’s investigation. They included Yevgeny Prigozhin, an oligarch known as Russian President Vladimir Putin’s “chef.”</p> <p>The poisoning of the former Russian double agent and his daughter is the first chemical weapons attack in Europe since World War II, the U.S. and its allies said, accusing Moscow of violating international laws. The Kremlin has denied any role in the attack and vowed to retaliate after British Prime Minister Theresa May announced the expulsion of 23 Russian diplomats, the biggest such move by the government since the end of the Cold War.</p> <p>But President Trump, acting on sanctioning powers granted by Congress months ago, was more muted in his criticism of the regime in Moscow and again avoided rebuking Mr. Putin personally.</p> <p>Asked if Mr. Putin was behind the nerve gas attack on Russian defector Sergei Skripal, Mr. Trump replied, “It looks like it.”</p> <p>“A very sad situation — it certainly looks like the Russians were behind it,” Mr. Trump told reporters during an Oval Office event with Irish Prime Minister Leo Varadkar in advance of St. Patrick’s Day. “Something that should never, ever happen. We’re taking it very seriously, as I think are many others.”</p> <p>Mr. Trump didn’t mention the sanctions or Russian meddling in the election, an issue that has been a sore point for the president since Democrats used it to try to question the legitimacy of his White House win. The president’s continued reluctance to call out Mr. Putin has raised eyebrows among Mr. Trump’s political foes and allies in Washington.</p> <p>British officials have been far more blunt in criticizing Russia, even as the U.S., France and Germany signed on to a letter saying there was “no plausible alternative explanation” to the nerve gas attack and calling it an assault on British sovereignty.</p> <p>The Russian government “should go away and shut up,” British Defense Secretary Gavin Williamson told reporters.</p> <p>Targeting the energy grid</p> <p>The Russians hit with U.S. sanctions were involved in election meddling and cyberattacks, including what Treasury Department and national security officials said were attacks on the U.S. energy grid, aviation system and infrastructure. It was the first time the administration fingered Russia for cyberattacks that began at least two years ago.</p> <p>Treasury Secretary Steven T. Mnuchin said the sanctions were part of a “broader effort to address the ongoing nefarious attacks emanating from Russia.”</p> <p>“The administration is confronting and countering malign Russian cyber activity, including their attempted interference in U.S. elections, destructive cyber-attacks, and intrusions targeting critical infrastructure,” he said in a statement.</p> <p>Moscow vowed to retaliate.</p> <p>“We have already started working on our reciprocal measures,” said Russian Deputy Foreign Minister Sergey Ryabkov. He didn’t elaborate on what response to expect.</p> <p>Moscow has denied involvement in the poisoning, and Mr. Putin has repeatedly denied — including directly to Mr. Trump last year — that Moscow meddled in the 2016 U.S. election.</p> <p>The sanctions target the Russian spy agency FSB and Russia’s military intelligence agency GRU, as well as the Internet Research Agency, which Mr. Mueller has signaled was behind much of the cybermeddling in the presidential election.</p> <p>Treasury officials blamed the GRU and the Russian military for trying to interfere in the U.S. vote and for launching the “NotPetya” ransomware attack that wreaked havoc last year across the U.S., Europe and Asia.</p> <p>House Foreign Relations Committee Chairman Edward R. Royce applauded the sanctions and said more needs to be done.</p> <p>“Russian cyberactors have been weaponizing information and targeting critical U.S. infrastructure undeterred for years,” said the California Republican. “As our midterm elections approach, we must send a clear message that attacks on our political process will not be tolerated.”</p> <p>Democrats slammed the sanctions for being too little, too late.</p> <p>“OK, it took 14 months, multiple indictments, and a poisoning in Britain … but … finally. Now we must protect our elections going forward,” tweeted Sen. Amy Klobuchar, Minnesota Democrat.</p> <p>Rep. Adam B. Schiff of California, the top Democrat on the House Permanent Select Committee on Intelligence and a driving force in accusations of Trump campaign collusion with Russia, called the sanctions a “grievous disappointment.”</p> <p>He noted that only two more senior Russian officials were included and that the Obama administration had imposed sanctions in December 2016 on the others. He said it showed no new work by the Trump administration.</p> <p>“It appears that Mr. Mueller is doing more to place consequences on Russia’s behavior than the rest of the administration,” said Mr. Schiff.</p> <p>Friend or foe</p> <p>White House spokeswoman Sarah Huckabee Sanders refused to clarify for reporters Thursday whether the White House considered Mr. Putin’s government a friend or an enemy.</p> <p>“Russia is going to have to make that determination,” she said. “They’re going to have to decide whether they want to be a good actor or a bad actor.”</p> <p>The Trump administration has punished Russia, including with sanctions, in response to its incursion into Ukraine and the forced closure of Russian outposts in San Francisco, New York and Washington.</p> <p>Senate Minority Leader Charles E. Schumer, New York Democrat, said that adding sanctions against the indicted Russians proved that Mr. Mueller’s investigation wasn’t a “witch hunt,” as the president claimed.</p> <p>“It’s more clear than ever that the president must not interfere with the special counsel’s investigation in any way,” Mr. Schumer said.</p> <p>The strained relations between the West and Russia reached a breaking point with the March 4 assassination attempt, which left the former spy, his daughter and a British police officer hospitalized with serious medical problems. Britain identified the nerve agent used as Novichok, which the Soviet military developed in the 1970s.</p> <p>Novichok is difficult to detect and it is believed to be 10 times more potent than other nerve agents such as VX and sarin.</p> <p>Mr. Skripal, 66, and his daughter, Yulia Scribal, 33, were found collapsed on a city bench in Salisbury, England, suffering from exposure to Novichok on March 4.</p> <p>In 2004, Mr. Skripal was convicted by the Russian government of spying for MI6 and accused of revealing the names of Russian agents working in the West. He was released to the U.K. in a spy swap in 2010, becoming an outspoken critic of Mr. Putin.</p> <p>During a visit Thursday to the attack site, Mrs. May made it clear that she believed the Kremlin was behind the attack.</p> <p>“We do hold Russia culpable for this brazen, brazen act and despicable act,” she said.</p>",Left,Right
0549bbca-a559-4b4e-be6b-07af81790f4f,"Trump signs $1.3 trillion spending bill, despite earlier threat to veto","President Trump is threatening to veto the Omnibus Spending Bill that passed the House and Senate yesterday, claiming that it does not fully fund a border wall or include a DACA solution.","<p>President Trump signed the $13 trillion omnibus spending bill Friday despite an earlier threat to veto the legislation due to the lack of border wall funding and a fix for DACA</p> <p>Trump signed the mammoth legislation reluctantly, saying in a press availability with other members of the administration that, in order to secure a necessary increase in military spending, he had to give money to Democratic projects that he derided as a ""wasted sum of money""</p> <p>""It's not right and it's very bad for our country,"" he said</p> <p>But he said that military spending was very important, and that concern overrode his thoughts about vetoing the legislation</p> <p>“Tfore, as a matter of national security, I've signed this omnibus budget bill T are a lot of things I’m unhappy about in this bill…But I say to Congress, I will never sign another bill like this again I'm not going to do it again,” he said</p> <p>He also called on Congress to end the filibuster in the Senate and to give him a line item veto</p> <p>“To prevent the omnibus situation from ever happening again, I'm calling on Congress to give me a line item veto for all government spending bills,"" he said ""And the Senate must end -- they must end -- the filibuster rule and get down to work”</p> <p>Trump had tweeted earlier Friday that he was considering using the veto, saying that recipients of the Obama-era Deferred Action for Childhood Arrivals (DACA) program “have been totally abandoned by the Democrats” He added that the border wall, which he said was ""desperately needed for our National Defense"" is not fully funded</p> <p>The House adjourned Friday morning until Monday, meaning that if Trump had vetoed the bill then the government would shut down</p> <p>Trump moved to end the DACA program in September, giving Congress a six-month window to come up with a legislative fix That deadline has been delayed by court orders, but the fate of the 800,000 enrolled recipients is still uncertain</p> <p>Trump addressed DACA recipients at the press availability: ""Republicans are with you,"" he said, before accusing Democrats of blocking efforts to fix DACA ""every step of the way""</p> <p>The White House has tried to use the DACA issue to convince Democrats to support approximately $25 billion in funding for Trump’s central campaign promise But a congressional GOP source told Fox News talks broke drown after Democrats pushed for a path to citizenship to include also those who are currently eligible -- expanding those covered to 18 million</p> <p>The spending bill passed by Congress includes only $16 billion for border measures -- much of which is for repairs to already existing fencing It explicitly rules out any new prototypes of the kind President Trump viewed this month in California But House Speaker Paul Ryan, R-Wis, and the White House pushed back against conservative concerns on Thursday, saying it provided for 100 miles of border construction</p> <p>FUNDING FOR BORDER WALL IN SPENDING BILL DIVIDES CONSERVATIVES, ESTABLISHMENT REPUBLICANS</p> <p>Democrats had claimed victory on the issue, pointing to the fact that Trump's requests for new deportation agents and detention center beds had gone unanswered, although they had expressed disappointment at the failure to get a DACA fix in the bill</p> <p>The deal has also irked more conservative members of Congress, who objected to the size and cost of the bill (which ran in at over 2,000 pages) as well as the failure to remove funding for Planned Parenthood and so-called ""sanctuary cities"" Other Republicans approved of the deal, pointing to a massive increase in military and infrastructure spending as well as funding to help combat the nation's opioid crisis</p> <p>Trump’s veto threat was totally unexpected, particularly as the White House had signaled Trump would support the bill if passed by Congress Most lawmakers have already left Washington for a two week recess Some are on overseas trips already</p>",Left,Right
061bce91-0472-4600-b6eb-ba06ccfbd32c,The Left Is Borrowing Hillary Hate From the Republican National Convention — With Dangerous Consequences,"The opening was unruly, with the firing of the DNC Chairman and unruly Sanders supporters. But the evening was all about unity.","<p>Photo: Jeff J Mitchell</p> <p>As the political focus moves from Cleveland to Philadelphia this week, there is hope among many Democrats that their convention can offer a positive, hopeful balm for last week’s nasty, brutish gathering and its distressing reliance on violent rhetoric. But there is also fear that the heightened anger and antipathy toward Clinton, which last week included calls for her imprisonment and extrajudicial punishment, could be contagious. This is especially disturbing because of where that rhetoric inevitably led last week: to suggestions that someone should do the candidate physical harm.</p> <p>The most widely reported of these calls was made last week by Donald Trump’s adviser, delegate, and New Hampshire state representative Al Baldasaro, who said in a radio interview that Clinton “should be put on the firing line and shot for treason.” Baldasaro explained that he saw Clinton’s executable offenses as being linked to the right-wing furor over the Benghazi attack and Clinton’s email server: “She is a disgrace for the lies that she told those mothers about their children that got killed over there in Benghazi. She dropped the ball on over 400 emails requesting backup security.”</p> <p>This strain of fury was stoked by prime-time convention speakers including Patricia Smith, whose son was killed in the Benghazi raid. “For all of this loss, for all of this grief, for all of the cynicism the tragedy in Benghazi has wrought upon America, I blame Hillary Clinton,” Smith said. “I blame Hillary Clinton personally for the death of my son.” (Since then, the mother of Ambassador J. Christopher Stephens has publicly asked the Trump campaign to stop invoking her son’s death in such an “opportunistic and cynical” way.)</p> <p>Baldasaro didn’t back down, but later amplified his calls for Clinton’s death, noting in a follow-up interview with BuzzFeed that, “anyone that commits treason should be shot … I believe Hillary committed treason.” This time, it seems, he was referring to the email scandal, claiming that “when people take confidential material off a server, you’re sharing information with the enemy. That’s treason.”</p> <p>Baldasaro was not alone in his calls for the death of the candidate who’s about to be the first woman ever nominated by a major party for the presidency. Earlier in the week, Michael Folk, a member of the West Virginia House of Delegates, had tweeted at Clinton, “You should be tried for treason, murder and crimes against the U.S. Constitution…then hung on the Mall in Washington, D.C.”</p> <p>As several people on Twitter pointed out, this use of the language of treason, even without explicit calls for execution, is far from anodyne. Five thousand copies of a flyer depicting John F. Kennedy as “Wanted for Treason,” and enumerating his sins, which included appointing anti-Christians to federal office and telling “fantastic LIES to the American people,” were distributed in Dallas, Texas, in the days before his 1963 assassination.</p> <p>The allegations of treason, lying, and criminality seem to offer moral cover to those who really, really hate Clinton, who hate her so much that their loathing can only be satisfied by fantasies about her violent and public demise. It allows her harshest critics to feel that their desire to hurt her stems from patriotism, perhaps to reassure themselves that their hate is not misogynistic but rather a commitment to moral, righteous justice.</p> <p>On Friday, former New York mayor Rudy Giuliani gave a speech in which he reiterated the claim that Clinton is a “criminal,” running not for office but to try to avoid “an orange jumpsuit,” and that if Donald Trump becomes president, he will “reopen the case.” Then, moving on to her electoral prospects, he felt comfortable using this language about her chances at the polls: “Hillary, we’re going to kill you in upstate New York.” According to Politico, he raised his voice and added, “We’re going to take you out in New York.”</p> <p>The language of physical harm is catching. When NPR’s “The Takeaway” reported from Cleveland bars last Thursday night after Trump’s speech, they interviewed a GOP vice-chair who slurred, “We’re building coalitions of the Asians, of the Orthodox Jews, Italians, Irish,” before growling, “We’re gonna hurt her.” The “Takeaway” hosts were briefly taken aback but then laughed off how much these jubilant, aggressive hordes had had to drink.</p> <p>All of this is why it is particularly alarming, as the Democratic convention kicks off in Philadelphia, to see protesters on the left voice their dismay with Clinton using the same “Lock her up!” chants and signs that say, “Hillary for Prison.” It’s why it’s so disconcerting to hear Green Party candidate Jill Stein stoke those protesters convictions that Hillary is a lawbreaker by telling them, as she did on Sunday, that she will urge Bernie Sanders to withdraw his endorsement of Clinton “based on the outright, purposeful sabotage of your campaign by the DNC and by Hillary Clinton.”</p> <p>The left certainly has its own longstanding, legitimate beefs with the candidate — about her vote to invade Iraq; her hawkishness; her position on Palestine; her relationship to banks; her support of her husband’s 1990s legislation, including the crime bill and welfare reform; her tendency toward safe centrism, as seen in her decision to pick Tim Kaine as her running mate as opposed to Elizabeth Warren or Sherrod Brown. But none of these issues are what’s being invoked when crowds of purported lefties shout about unproven crimes, fraud, rigging, sabotage, or when they cheer for Clinton’s imprisonment.</p> <p>Some progressives are eager to turn the hacked DNC emails into a scandal that proves malfeasance that thereby delegitimizes primary results, but it does no such thing. In fact, the email hack, as embarrassing as it might be, provides ample evidence that there was no rigging of the primary process by the DNC. There were a bunch of people who worked for the Democratic Party who hated Sanders, who hadn’t been a member of the party for very long, and who was seriously challenging the party favorite. They didn’t do anything about it. The one guy who suggested, horribly, that they attack Sanders on his lack of faith got shot down. It should now be abundantly clear that there was no systematic conspiracy to rob Sanders of the Democratic nomination. (And if there had been, it certainly could not have been pulled off by an organization that cannot tell its ass from its elbow. The only good news in all this is that Deborah Wasserman Schultz, who was not good at her job, is no longer in charge of the DNC.)</p> <p>When RoseAnn DeMoro, the executive director of National Nurses United, tweets that “our election was stolen, rigged” and that Wasserman Schultz was not “acting on her own”; when progressives cheer for WikiLeaks, which yesterday retweeted Ann Coulter’s racism and some anti-Semitism of its own; when Democrats are chanting “Lock her up!” the language and objectives of left and right become increasingly indistinguishable.</p> <p>This isn’t issues-based dismay over Hillary Clinton, and if it once were, it has transformed into something far more grotesque and dangerous. The merging of left-leaning political antagonism toward Hillary with the distortions of the right has left us here, with progressives — people who care deeply about our planet, about health care, about immigration, about minimum wage and police brutality and voting rights and reproductive rights and the future of the Supreme Court — heaping outsized condemnation not at the fascistic ogre who rose in Cleveland last week, but at the only person who realistically stands between him and his stewardship of this country. A vocal portion of the left is now aping the fantasy constructions of the right wing, showing themselves more focused on Hillary’s personal destruction than on any of the crucial issues at stake in November. Welcome to the Democratic National Convention.</p>",Right,Left
0b0e4793-c778-432e-a738-d95bc92adf8b,Marco Rubio: Donald Trump is a ‘con artist’ who sticks it to the little guy,Rubio Unleashes On Trump,"<p>Sen. Marco Rubio on Friday attacked GOP presidential front-runner Donald Trump as a “con artist” who has spent much of his life sticking it to the “little guy” and that the United States is on the brink of turning over the nuclear codes to an “erratic individual.”</p> <p>“I can just tell you that a con artist is about to take over the Republican party and the conservative movement, and we have to put a stop to it,” Mr. Rubio, Florida Republican, said on “CBS This Morning.”</p> <p>“Donald Trump last night had no answers on the issue of health care,” he said. “The media’s pumping him up as some sort of unstoppable force. Donald Trump has portrayed himself now consistently as fighting for the working people, and he has a record of sticking it to working people for 35 years.”</p> <p>“We’re going to put a stop to it now,” Mr. Rubio said. “There is no way we are going to allow a con artist to take over the conservative movement, and Donald Trump is a con artist.”</p> <p>Mr. Rubio had spent much of Thursday night’s GOP debate attacking Mr. Trump, notably on his business record, and said without a sizable inheritance, the billionaire businessman would be selling watches in Manhattan.</p> <p>“This is the most important government job on the planet, and we’re about to turn over the conservative movement to a person that has no ideas of any substance on the important issues, the nuclear codes of the United States to an erratic individual, and the conservative movement to someone who has spent a career sticking it to working people,” Mr. Rubio said on CBS.</p> <p>SEE ALSO: Trump on defensive in nasty GOP debate</p> <p>“I will acknowledge that there are some people watching this broadcast that are intrigued by him, that they think he’s a straight talker and he fights for the little guy, but Donald Trump has spent 40 years sticking it to the little guy, or longer, and every time one of those businesses of his failed, you know who didn’t get paid? The little guy that was working for him,” he said.</p> <p>Speaking on CNN after the debate on Thursday, Mr. Trump dismissed Mr. Rubio as a “meltdown guy” who sweats too much.</p> <p>“He’s a meltdown guy,” Mr. Trump said. “I mean, I’m looking at him, he’s pouring sweat. I’ve never seen anything like it; I don’t know what the problem is. He’s just pouring down sweat. We have to have somebody that doesn’t sweat. … We need somebody that doesn’t have whatever that is that he’s got.”</p>",Left,Right
