docid,title,event,full_text,human_label,outlet_bias
a2934c1c-1dd7-4ff2-8f85-d4f56dfabad8,"Donald Trump slams Ken Frazier, Merck CEO, for quitting manufacturing council over Charlottesville","President Trump made a statement today regarding the events in Charlottesville, VA over the weekend in which he explicitly condemned "" the KKK, neo-Nazis, white supremacists and other hate groups."" This statement came after bipartisan criticism of the president's initial response to the violence in Charlottesville.","<p>President Trump slammed Merck CEO Ken Frazier for quitting the president’s manufacturing council on Monday.</p> <p>“Now that Ken Frazier of Merck Pharma has resigned from President’s Manufacturing Council,he will have more time to LOWER RIPOFF DRUG PRICES!” Mr. Trumptweeted.</p> <p>Mr. Frazier announced his resignation in a statement Monday, citing Mr. Trump’s reaction to the Charlottesville, Virginia, protests over the weekend. The CEO was part of the president’s manufacturing council, comprised of several business executives, aimed at boosting job growth.</p> <p>“America’s leaders must honor our fundamental values by clearly rejecting expressions of hatred, bigotry and group supremacy, which run counter to the American ideal that all people are created equal,” Mr. Frazier’s statement read in part.</p> <p>Mr. Trump’s response to the violent protests, where one woman and two police officers were killed, has been heavily criticized for not calling out the white supremacists directly and instead condemning all violence. White supremacists and neo-Nazis attended a white nationalist rally to protest the removal of a statue of Confederate Gen. Robert E. Lee.</p> <p>Copyright © 2018 The Washington Times, LLC. Click here for reprint permission.</p>",Left,Right
a5c19641-f21a-4898-bb72-1819660fe155,Donald Trump Eats Taco Bowl To Prove He Really Loves Hispanics,Not Ready to Support Trump,"<p>U.S. Republican presidential candidate Donald Trump speaks during a campaign rally at the Allen County War Memorial Coliseum in Fort Wayne, Indiana, U.S., May 1, 2016. REUTERS/Kamil Krzaczynski</p> <p>Republican presidential candidate Donald Trump tweeted a picture of himself eating a taco bowl Thursday, making sure to let the world know he loves Hispanics and wishes them all a happy Cinco de Mayo.</p> <p>Happy #CincoDeMayo! The best taco bowls are made in Trump Tower Grill. I love Hispanics! https://t.co/ufoTeQd8yApic.twitter.com/k01Mc6CuDI — Donald J. Trump (@realDonaldTrump) May 5, 2016</p> <p>Trump has outraged many Hispanics by saying some illegal immigrants were rapists. A Buzzfeed reporter reached out to the grill and said the taco bowls are not on the menu.</p> <p>Just got off phone with Trump Grill, says they don’t serve taco bowls. It’s not on the menu online. — andrew kaczynski (@BuzzFeedAndrew) May 5, 2016</p> <p>But it turns out the item was likely a special Cinco de Mayo option for the Trump café.</p> <p>.@BuzzFeedAndrew @alexweprin it’s a special Cinco de Mayo menu item at the Trump Cafe https://t.co/qg6qLp1vzU — Neetzan Zimmerman (@neetzan) May 5, 2016</p> <p>The menu describes the “Taco Fiesta” as “ground sautéed beef with jalapeños, onions, tomatoes, and chili spices, served in a taco shell topped with lettuce and cheddar cheese” for $13.50.</p> <p>Send tips to [email protected]. Follow Casey on Twitter and like him on Facebook.</p> <p>Content created by The Daily Caller News Foundation is available without charge to any eligible news publisher that can provide a large audience. For licensing opportunities of our original content, please contact [email protected].</p>",Left,Right
a973071e-ec9b-4819-8f00-3fbdf3d07003,A Conversation With Trump’s Veterans Co-Chair About Khizr Khan,Donald Trump continues to be attacked by Gold Star families and some in the GOP for his comments to the father of a slain Muslim U.S. solider. Did he go too far?,"<p>New Hampshire Representative Al Baldasaro is a co-chair of the Trump campaign for veterans’ issues. He helped write Trump’s veterans’ plan. He appeared as a surrogate for the Trump campaign around the country — including events in South Carolina, Florida, Texas, Delaware and New York. He served as a delegate for Trump at the Republican convention and was a member of the credentialing committee.</p> <p>Reached by phone in New Hampshire, Baldasaro told ThinkProgress that he believes Khizr Khan, the gold star father who criticized Trump at the Democratic convention, is an agent of the Muslim Brotherhood. Baldasaro explained that he believes Khan has “long ties to the Clinton and Obama campaign.” That is damning because “in the White House there is the Muslim Brotherhood.” Baldasaro suggested “looking it up on the internet” for more information.</p> <p>There is no evidence that Khan had any connection to Clinton or Obama prior to agreeing to speak at the Democratic convention.</p> <p>Earlier today Baldasaro tweeted an article from a fringe anti-Islam conspiracy site, making similar claims.</p> <p>On the phone several hours later, Baldasaro maintained that the article could be accurate because one the authors, Walid Shoebat, “has been on TV.”</p> <p>Still, after tweeting the article multiple times, Baldasaro began to have second thoughts because he didn’t like what the article “said about the son.” The article suggested Humayun Khan, a recipient of the Bronze Star, was a double agent “working for the US and Al-Qaeda… killed before his Islamist mission was accomplished.” (That language was recently deleted from the article.)</p> <p>Baldasaro tweeted that he is “not sure about [Shoebat’s] credibility.” Still all of his earlier tweets — and his belief that Khan is an agent of the Muslim Brotherhood — remain.</p> <p>Indeed, Baldasaro expanded his critique of Khizr Khan. He said he was “sickened” and “disgusted” by Khan, accusing him of using his son as a political pawn.</p> <p>Khan famously implored Trump to read the Constitution, offering to lend his well-worn pocket edition. “Mr. Khan needs to read the constitution about the duties of the President,” Baldasaro said, adding that his attacks on Trump were “half cocked.”</p> <p>Baldasaro said he had not been contacted by the Trump campaign concerning his tweets on Khan.</p> <p>Last month, Baldasaro called on Hillary Clinton to be executed by firing squad and refused to apologize. The Trump campaign issued a mild statement saying that they “do not agree” with Baldasaro but was “incredibly grateful for his support.” Baldasaro told ThinkProgress that his role with the Trump campaign had not changed at all since the incident.</p> <p>Despite his title and extensive involvement with the Trump campaign, Baldasaro insisted that he was speaking only for himself.</p> <p>“I don’t speak for Trump,” he said, “Only Trump speaks for Trump.”</p>",Right,Left
aa8235a0-3302-4f83-936b-2728d2914613,Jeff Sessions Called For A Special Counsel After Loretta Lynch Met With Bill Clinton,"Attorney General Jeff Sessions met twice last year with the top Russian diplomat in Washington whose interactions with President Donald Trump's former national security adviser Michael Flynn led to Flynn's firing. Sessions did not mention either meeting during his confirmation hearings. A Justice official said Sessions didn't mislead senators during his confirmation, since he was asked about communication between Russia and the Trump campaign - not about meetings he took as a senator and a member of the Armed Services Committee.","<p>In November, then-Sen. Jeff Sessions (R-Ala.) called for Loretta Lynch to recuse herself from any investigation into Hillary Clinton’s use of a private email server or improper conduct by the Clinton Foundation, saying the attorney general could not be impartial after her impromptu meeting with former President Bill Clinton on an airplane in Phoenix.</p> <p>“When a high public official is accused of serious wrongdoing and there is a sufficient factual predicate to investigate, it is imperative the investigation be thorough, with dispatch and without partisanship,” Sessions wrote in an op-ed, co-signed by other high-profile Donald Trump supporters.</p> <p>Sessions is now the attorney general. And he is so far resisting calls to recuse himself from any investigation into Russia’s interference in the 2016 elections ― even after The Washington Post reported that he met with Russia’s ambassador to the U.S. twice during the campaign, and that he failed to disclose those encounters when asked about them under oath during his confirmation hearing.</p> <p>“I’m not aware of any of those activities,” Sessions said in January, when Sen. Al Franken (D-Minn.) asked him whether anyone affiliated with the Trump campaign had met with Russian officials.</p> <p>“I have been called a surrogate at a time or two in that campaign and I did not have communications with the Russians,” he added.</p> <p>Sessions has maintained that his conversations with the ambassador were part of his duties as a member of the Senate Armed Services Committee, not as a Trump surrogate.</p> <p>But even with that explanation, his position has become far more precarious following the Post’s story. A growing number of Democrats and some Republicans have called on him to step aside from any investigation into Russia’s role in the election and whether Trump associates or campaign aides had improper contact with Russian officials during that time.</p> <p>Some of these Democrats, it's worth noting, are themselves singing a different tune on impartiality now than they used to. Senate Minority Leader Chuck Schumer (D-N.Y.), for example, has called for Sessions to recuse himself, but previously defended Lynch's ability to handle the Clinton investigation after the airplane meetup.</p> <p>Still, Sessions' earlier call for Lynch to recuse herself makes it all the more difficult for him to argue now that he should remain in a managerial or oversight role in the investigations that the FBI, which reports up to the Justice Department, has launched into Russia’s election interference.</p> <p>Indeed, during his confirmation hearing for the attorney general post, Sessions said that had he been in Lynch’s shoes at the time of the meeting with Bill Clinton, he would have stepped aside.</p> <p>“She did not officially recuse. And there is a procedure for that, which I would follow,” he said, as noted by the Democratic opposition research group American Bridge. “I believe that would be the best approach for the country because we can never have a political dispute turn into a criminal dispute. That’s not in any way that would suggest anything other than absolute objectivity. This country does not punish its political enemies, but this country ensures that no one is above the law.”</p>",Right,Left
ad932c47-548c-44d1-801e-c651f5323046,"BROKEN PROMISE: Trump, GOP Congress Give Planned Parenthood $500 Million In Taxpayer Funds","President Trump is threatening to veto the Omnibus Spending Bill that passed the House and Senate yesterday, claiming that it does not fully fund a border wall or include a DACA solution.","<p>President Donald Trump and congressional Republicans broke their promise to conservative voters by including funding for Planned Parenthood, which receives approximately $500 million in taxpayer funding each year, in the omnibus bill that Trump signed into law on Friday.</p> <p>Trump, Speaker of the House Paul Ryan and other Republican leaders promised their voters for years that they would defund Planned Parenthood if given the chance to govern.</p> <p>Now, with Republican majorities in the House and Senate and a Republican in the White House, the nation’s number one killer of unborn children will continue receiving hundreds of millions of dollars in taxpayer funding.</p> <p>Planned Parenthood receives approximately $500 million in taxpayer funding every year through Medicaid and Title X grants for family planning. (RELATED: Twitter Won’t Stop Censoring Pro-Lifers)</p> <p>The spending bill breaks Trump’s campaign promise to his voters, but it does fulfill a promise that his Democratic opponent, Hillary Clinton, made on the campaign trail in 2016.</p> <p>Clinton promised to continue funding Planned Parenthood if elected president, while Trump assured his voters that he would defund the abortion giant if he won.</p> <p>Republican Texas Sen. Ted Cruz said he voted against the spending bill in part because it provided taxpayer funding for Planned Parenthood. (RELATED: Planned Parenthood Partners Admit To Liability For Selling Baby Parts)</p> <p>“It continues to fund Planned Parenthood, a corrupt organization whose horrifying abortion practices should preclude it from receiving taxpayer dollars,” Cruz said.</p> <p>Republican Kentucky Sen. Rand Paul also voted against the omnibus bill, citing the legislation’s Planned Parenthood funding.</p> <p>Watch Tim Tebow’s Mom Give Inspiring Pro-Life Speech At The March For Life:</p> <p>Follow Hasson on Twitter @PeterJHasson</p> <p>Content created by The Daily Caller News Foundation is available without charge to any eligible news publisher that can provide a large audience. For licensing opportunities of our original content, please contact [email protected].</p>",Left,Right
b1d5c5b0-b07c-4ea6-a106-57c9049a07b9,Trump Makes Speling Graet Agane,Rubio Unleashes On Trump,"<p>It's a good thing he has people to tie his shoes for him. (Photo by Joshua Lott/Getty Images)</p> <p>Donald Trump’s tiny, infant-like hands are hilarious, aren’t they? He has baby carrots for fingers, and he really hates when you point out how ridiculous and inadequate they are. Just Google “short-fingered vulgarian” and enjoy his humiliation.</p> <p>In addition to being a perpetual sight gag he carries around on the ends of his arms, Trump’s grotesquely malformed digits also cause him to make amusing spelling mistakes online. His stubby little booger-hooks are too small to properly maneuver a keyboard!</p> <p>For example, after he got clobbered in the GOP debate last night, he fired off these petulant, barely coherent tweets:</p> <p>Lightweight Marco Rubio was working hard last night. The problem is, he is a choker, and once a choker, always a chocker! Mr. Meltdown. — Donald J. Trump (@realDonaldTrump) February 26, 2016</p> <p>Choker… choker… “chocker”? Hey, two out of three ain’t bad!</p> <p>Wow, every poll said I won the debate last night. Great honer! — Donald J. Trump (@realDonaldTrump) February 26, 2016</p> <p>“Honer.” Isn’t it weird that Donald Trump can’t spell the word that he’s based his whole life around?</p> <p>Lying Ted Cruz and leightweight chocker Marco Rubio teamed up last night in a last ditch effort to stop our great movement. They failed! — Donald J. Trump (@realDonaldTrump) February 26, 2016</p> <p>And now it’s “leightweight chocker.” A twofer!</p> <p>Trump really seems to like that one. Say what you want about the guy, but he knows how to commit to a bit:</p> <p>Leightweight chocker Marco Rubio looks like a little boy on stage. Not presidential material! — Donald J. Trump (@realDonaldTrump) February 26, 2016</p> <p>That’s a keeper. I expect to see bright red “LEIGHTWEIGHT CHOCKER” hats for sale any minute now.</p> <p>The folks at Merriam-Webster are glad to translate Trump’s stupidity into standard English for GOPe cucks like me:</p> <p>I thought Obama would be the dumbest president in American history for a really long time. But he’s about to get Trumped!</p> <p>Update: Ha ha, Trump just deleted all those inept tweets and replaced them with slightly less stupid versions. I can only imagine his shame and humiliation right now. But I have a really good imagination!</p> <p>Here's the screenshot for the last one he deleted pic.twitter.com/Tl2E7FvueB — Greg Pollowitz (@GPollowitz) February 26, 2016</p> <p>Update: Trump stinks!</p> <p>Rubio finally gets it. You don't show up to a circus to recite from Conscience of a Conservative.</p> <p>pic.twitter.com/qWnQ9Zl6Uh — Comfortably Smug (@ComfortablySmug) February 26, 2016</p> <p>Update:</p> <p>I wonder how long it'll be till Trumpkins start severing the tips of their fingers, Yakuza-style, so as not to show up the boss? — Jim Treacher (@jtLOL) February 26, 2016</p> <p>Update: This day just keeps getting better and better: Chris Christie just endorsed Trump! I hope he’s angling for VP, because it’ll be cool to have a guy living in the Naval Observatory who’s never actually observed his navel. And he’ll be able to work on his pretty decent Trump impression…</p>",Left,Right
b840383b-2266-48a1-bfef-91d652ec3f62,Donald Trump’s Foreign Workers: American Workers Aren’t Good Enough,Rubio Unleashes On Trump,"<p>Trump Tower in New York City (Spencer Platt/Getty)</p> <p>The news that Donald Trump turned down 94 percent of American job applicants to his Mar-a-Lago club in Palm Beach, Fla., in favor of foreign workers brought in under the H-2B visa program should come as a surprise to absolutely no one. Over the course of the campaign season, Trump has proven himself a liar of Clintonian proportions, and there has never been any reason to believe that he was somehow more trustworthy when it came to his rhetorical opposition to America’s foolish immigration policies — the ostensible raison d’être for his presidential campaign, one might recall. Moreover, the fact that he is more gold-obsessed than King Midas should have suggested otherwise.</p> <p>And, indeed, this turns out not to be the first time that Donald Trump has undermined American workers to expand his profit margin. That has been his M.O. throughout his career.</p> <p>Advertisement</p> <p>In the early 1980s, Donald Trump was a thirtysomething real-estate up-and-comer embarking on what would, for a while, be the tallest all-glass structure in Manhattan, and what remains the centerpiece of the Trump architectural empire, his Vanity of Vanities: Trump Tower, on New York City’s Fifth Avenue. According to Barbara Res, the then-31-year-old who Trump selected to oversee Trump Tower’s construction, the Donald humbly referred to Trump Tower as “The Most Important Project in the World.”</p> <p>Apparently, the first leg of the project was too important to entrust to American workers. In a lawsuit filed in Manhattan Federal Court, members of House Wreckers Local 95 alleged that, to avoid paying union employees their pension and welfare benefits, Trump (and the contractor he used for the job, Kaszycki & Sons) brought in some 200 undocumented Polish workers to demolish the Bonwit Teller building that then occupied the site of the future Trump Tower.</p> <p>RELATED: What if Trump Doesn’t Have Billions?</p> <p>Trump denied the claims, testifying that he only found out that undocumented workers were employed on the site long after the demolition. He demurred about even having visited the site. That turned out not to be true: “Testimony established that Donald Trump visited the 57th Street site and observed Kaszycki’s Polish workers, noting that they were ‘good hard workers,’” the U.S. District Court for the Southern District of New York wrote in its opinion in 1991. “Workers also observed Trump visiting the job site of the Bonwit Teller demolition job.” And it’s likely that he would have been able to distinguish between union and non-union workers: “The Polish workers were obvious not only in numbers but also in appearance. In contrast to the union workers the non-union, Polish workers were distinguished by the fact that most of them did not wear hard hats. In addition the Polish workers staged several very visible work stoppages because they were not being paid their wages.”</p> <p>Trump-owned companies have tried to import 1,100 workers on temporary visas since 2000.</p> <p>There were other good reasons to disbelieve Trump. Daniel J. Sullivan, a labor consultant and FBI informant who had advised Trump on the demolition, testified that Trump told him about undocumented workers at the site. Meanwhile, Thomas Macari, a vice president of Trump-Equitable and its manager in charge of the demolition of the Bonwit Teller Building, was on the site regularly. According to the court opinion, Macari “was involved in every aspect of the demolition job. He knew the Polish workers were working ‘off the books,’ that they were doing demolition work, that they were non-union, that they were paid substandard wages with no overtime pay, and that they were paid irregularly if at all.” And, as if that were not enough, Macari had interacted extensively with John Szabo, an immigration lawyer representing undocumented workers who were making claims for unpaid wages. In court, Szabo testified that a “John Barron” of the Trump organization had called him in 1980 and threatened a $100 million lawsuit if Szabo did not drop the undocumented workers’ claims — and Trump admitted that he and another of his executives sometimes used “John Barron” as an alias in business dealings. (As ex post facto confirmation of Szabo’s claim, consider that a) bullying inconvenient individuals is a go-to Trump tactic, and b) his son by his third wife, Melania, is “Barron William Trump.”)</p> <p>Advertisement</p> <p>RELATED: The Litigious — and Bullying — Mr. Trump</p> <p>Advertisement</p> <p>The court ruled against Trump, finding that he and Kaszycki & Sons had “knowingly participated” in a scheme to get out of paying the union what it was owed. Trump won a partial victory on appeal, when the Second Circuit overturned part of the decision and referred the rest of it for “further proceedings.” But the available facts are hard to dispute.</p> <p>#share#Some three decades later, nothing has changed. Last year, the Washington Post reported that Trump is using undocumented workers in the construction work on his much-feted project to convert Washington, D.C.’s Old Post Office Pavilion into a luxury hotel. “Interviews with about 15 laborers helping renovate the Old Post Office Pavilion revealed that many of them had crossed the U.S-Mexico border illegally,” the Post’s Antonio Olivo wrote in July, “before they eventually settled in the Washington region to build new lives.”</p> <p>Donald Trump is not looking out for American workers. He is looking out for his own pocketbook.</p> <p>Trump’s executive vice president and legal counsel, Michael Cohen, “said the question of illegal hiring practices had not arisen before at a Trump work site.” (Ahem? — see above.) He then pointed the finger at the contractor Trump has employed: “Mr. Trump, who is the 100 percent owner of the Old Post Office, hired one of the largest contractors in the world to act as the general contractor. That company is Lend Lease. They then go out and employ subcontractors to work for them. The obligation to check all workers on site is exclusive to Lend Lease. This of course assumes that the assertion regarding the employees’ status is accurate.” Of course, if history is any indication, just because Trump is employing a contractor does not mean he is unaware of the status of at least some of the workers.</p> <p>Advertisement</p> <p>Advertisement</p> <p>Furthermore, it’s hard to imagine that Trump is utterly in the dark about his D.C. project. He apparently has spent days “beat[ing] up some contractors” employed in the development, as he boasted on Kelly Ripa’s radio show in January of last year. And he told Pat Robertson, during a visit to Regent University earlier this week, that his daughter, Ivanka, is spearheading the project, with help from his sons, Donald Jr. and Eric (the executive vice president and executive vice president, developments and acquisitions, of the Trump Organization, respectively).</p> <p>#related#And, of course, there is Trump’s use and abuse of America’s visa programs, beyond Mar-a-Lago. Reuters reviewed Department of Labor data last August, and reports that Trump-owned companies have tried to import 1,100 workers on temporary visas since 2000. Jobs “that Americans won’t do” include waitress, cook, vineyard worker, golf-course superintendent, hotel manager, banquet manager, and maid. Additionally, American women apparently are not attractive enough for Donald Trump; the Trump Model Management and Trump Management Group LLC have sought to import 250 fashion models from overseas.</p> <p>Conservative voters who believe that a President Trump will enforce and strengthen our immigration laws, will prosecute those who violate them, and will put the interest of American workers first are deluding themselves. Donald Trump’s professional history is one of undermining American workers — by exploiting the law wherever possible and, when that’s not enough, breaking it outright. Donald Trump is not looking out for American workers. He is looking out for his own pocketbook. That’s not going to change by putting him in the White House.</p>",Left,Right
