docid,title,event,full_text,human_label,outlet_bias
6f87db97-ac60-42b7-9f0e-febaa2a3cdcf,Steve Bannon subpoenaed during House Intel meeting for information the White House instructed him not to give,Steve Bannon appears before the House Intelligence Committee to answer questions about his role in Trump's campaign and any connection to Russian operatives.,"<p>Fallen former President Trump confidante Steve Bannon was served immediate subpoenas during his closed-door meeting with lawmakers Tuesday to provide testimony on information the White House instructed him not to share, according to sources with knowledge of the conversations.</p> <p>In the now hours-long, ongoing interview conducted by investigators for the House Intelligence Committee, Bannon’s attorney told lawmakers that the White House directed his client not to answer questions about his time in the White House or during the transition.</p> <p>Sources told Fox News Bannon did not invoke any sort of legal “privilege,” including executive privilege, to support this refusal.</p> <p>The sources told Fox News that lawmakers grilled Bannon and his attorney over their refusal to answer. At that point, some members of the committee recommended subpoenas for Bannon, and documents related to the issues.</p> <p>Bannon was also subpoenaed by Robert Mueller as part of the special counsel investigation into Russian meddling and potential collusion with Trump campaign associates during the 2016 presidential election. Bannon could be forced to testify before a grand jury.</p> <p>Bannon's testimony behind closed doors is his first appearance on Capitol Hill since he ran afoul of the administration over quotes attributed to him in a bombshell book.</p> <p>A source close to the comittee told Fox News that the former White House chief strategist and Trump campaign manager will likely be questioned over information in Michael Wolff’s book: “Fire and Fury: Inside the Trump White House.”</p> <p>In the book, Bannon slammed the president’s eldest son, Donald Trump Jr., son-in-law Jared Kushner and ex-campaign chairman Paul Manafort. Bannon called their infamous June 2016 meeting in Trump Tower with the Russian attorney Natalia Veselnitskaya during the campaign “treasonous” and “unpatriotic.”</p> <p>RUSSIAN LAWYER WHO MET TRUMP JR.: 'I WOULD HAVE' CONTACTED CLINTON, TOO, IF SHE COULD HELP</p> <p>“Even if you thought that was not treasonous, or unpatriotic, or bad s**t, and I happen to think it’s all of that, you should have called the FBI immediately,” Bannon said in the book.</p> <p>Bannon also said Trump Jr. would be cracked ""like an egg on live TV” in any possible public testimony about the situation.</p> <p>Bannon, who stepped down as executive chairman of Breitbart News last week following a dramatic falling out with President Trump over the Wolff book, and who left his White House post in August, is also likely to be questioned over his role on the campaign, as opposed to his time working in the Trump administration.</p> <p>STEVE BANNON STEPS DOWN AS EXECUTIVE CHAIRMAN OF BREITBART NEWS</p> <p>Bannon has a prominent role in Wolff’s book, which enraged the president enough to have his personal attorneys demand the publisher halt the book’s release—a request that was quickly rejected. The lawyers also sent a “cease and desist” notice to Bannon, arguing that he violated a non-disclosure agreement signed during the campaign, by disclosing confidential information in speaking to the media about campaign and disparaging members of the Trump family.</p> <p>The president issued a multi-paragraph blistering takedown of “Sloppy Steve” Bannon, after the first excerpts of Wolff’s book were released, seeking to distance himself from his former chief strategist.</p> <p>TRUMP SLAMS BANNON AFTER CRITICISM, SAYING EX-CHIEF STRATEGIST 'LOST HIS MIND'</p> <p>“Steve Bannon has nothing to do with me or my presidency,” Trump said in the statement. “When he was fired, he not only lost his job, he lost his mind.”</p> <p>When he left the White House, Bannon said he would work to help Trump and wage a populist campaign from the outside.</p> <p>“If there’s any confusion out there, let me clear it up: I’m leaving the White House and going to war for Trump against his opponents -- on Capitol Hill, in the media and in corporate America,” Bannon said in August upon leaving his post.</p> <p>Later this week, other Trump campaign officials, former campaign manager Corey Lewandowski and former campaign spokeswoman now-White House Communications Director Hope Hicks, will testify before the same committee as part of its probe into Russian meddling and potential collusion with Trump campaign associates during the 2016 presidential election.</p> <p>Fox News' Chad Pergram contributed to this report.</p>",Left,Right
77edcae2-99c2-48cf-a7c2-4cbf45592e65,FBI reopens Clinton probe after new emails found in Anthony Weiner case,"On Friday, the FBI announced that it has now reopened its investigation into Hillary Clinton's private email server after discoveries it made from its investigation of Congressman Anthony Weiner's activities.","<p>Democratic presidential candidate Hillary Clinton called on the FBI Friday to release all information in its renewed investigation into her use of a private server while secretary of state after discovering new emails – apparently during the probe of former Rep. Anthony Weiner’s sexting – in a stunning turn of events just days before the presidential election.</p> <p>""[FBI Director James Comey] himself has said he doesn’t know whether the emails ... are significant or not,"" Clinton told reporters in Iowa Friday evening. ""I’m confident whatever they are will not change the conclusion reached in July. Therefore it’s imperative that the bureau explain this issue in question, whatever it is, without any delay.""</p> <p>Earlier Friday, Comey informed top members of Congress in a letter that the bureau had “learned of the existence of emails that appear to be pertinent to the investigation.”</p> <p>CLICK HERE TO READ THE LETTER</p> <p>Comey did not detail those emails, saying only that they surfaced “in connection with an unrelated case.”</p> <p>An FBI source, though, confirmed to Fox News that the new emails were discovered after the bureau seized devices belonging to disgraced ex-Rep. Weiner and his wife Huma Abedin, a top Clinton aide who recently announced she was separating from the former congressman. The New York Times first reported on the Weiner investigation connection, noting the FBI had been probing texts Weiner sent to a 15-year-old girl.</p> <p>As Donald Trump and congressional Republicans seized on the FBI’s decision, interim Democratic Party leader Donna Brazile simply tweeted, “Good grief,” after the news of the Anthony Weiner connection broke. The Clinton campaign called the decision to revisit the case so close to the election “extraordinary,” and urged Comey to provide more details.</p> <p>Comey gave only a brief overview in his letter to lawmakers of what prompted their decision. He wrote that the investigative team briefed him on the information a day earlier, “and I agreed that the FBI should take appropriate investigative steps designed to allow investigators to review these emails to determine whether they contain classified information, as well as to assess their importance to our investigation.”</p> <p>He said the FBI could not yet assess whether the new material is significant and he could not predict how long it will take to complete “this additional work.”</p> <p>1,000 CLINTON-PETRAEUS EMAILS MISSING FROM RECORDS SENT TO STATE, FBI FILES SHOW</p> <p>FBI, DOJ ROILED BY DECISION TO LET CLINTON SLIDE, SAY SOURCES</p> <p>The move comes after Comey and the Justice Department decided in July not to pursue charges over Clinton's email practices, saying at the time that the investigation was finished.</p> <p>Comey later came under criticism from Trump, GOP lawmakers and others who claim the investigation downplayed the mishandling of classified information during Clinton's tenure.</p> <p>Trump, speaking to cheering supporters Friday afternoon in Manchester, N.H., praised the FBI for having the “courage” to “right the horrible mistake that they made” – saying he hopes that is “corrected.”</p> <p>“Hillary Clinton’s corruption is on a scale we have never seen before,” Trump said. “We must not let her take her criminal scheme into the Oval Office.”</p> <p>In a nod to the significance of the FBI’s announcement, Trump quipped: “The rest of my speech is going to be so boring.”</p> <p>Other GOP lawmakers also weighed in, urging the bureau to pursue a thorough new probe.</p> <p>“The FBI’s decision to reopen its investigation into Secretary Clinton reinforces what the House Judiciary Committee has been saying for months: the more we learn about Secretary Clinton’s use of a private email server, the clearer it becomes that she and her associates committed wrongdoing and jeopardized national security,"" House Judiciary Committee Chairman Bob Goodlatte, R-Va., said in a statement.</p> <p>Republican National Committee Chairman Reince Priebus said the discovery must be “serious” for the bureau to investigate this close to the election.</p> <p>Clinton did not respond to questions from reporters about the development as she landed in Cedar Rapids, Iowa, and did not address the matter while speaking to supporters in the same city.</p> <p>But Clinton Campaign Chairman John Podesta sharply questioned the FBI's move and said Comey should ""immediately provide"" more information.</p> <p>""Upon completing this investigation more than three months ago, FBI Director Comey declared no reasonable prosecutor would move forward with a case like this and added that it was not even a close call. In the months since, Donald Trump and his Republican allies have been baselessly second-guessing the FBI and, in both public and private, browbeating the career officials there to revisit their conclusion in a desperate attempt to harm Hillary Clinton's presidential campaign,” he said in a statement.</p> <p>Podesta said “we have no idea what those emails [that have come to light] are and the Director himself notes they may not even be significant.”</p> <p>According to a source connected to the Clinton campaign who spoke to law enforcement, the FBI has four devices – one belongs to Abedin, and at least one belongs to Weiner. So far, no classified information has been found on the devices, Fox News is told.</p> <p>The development comes 11 days before the general election, and is the latest shockwave to hit the race. Clinton had been gaining in the polls over Trump in the wake of the release of footage showing Trump talking about groping women and subsequent allegations of sexual assault and harassment against him which he denies.</p> <p>However, daily revelations from hacked Clinton campaign emails obtained by WikiLeaks have become a headache for the Democrat's campaign. The resumption of the FBI probe poses a potentially bigger problem.</p> <p>Ron Hosko, former assistant director of the FBI, told Fox News in a telephone interview that retired FBI officials were ""livid"" at Comey over the fact that charges were not brought against Clinton in round one of the investigation.</p> <p>""He lit her on fire and then walked away,"" Hosko said of Comey holding a news conference laying out Clinton's mishandling of classified information but then not pressing criminal charges.</p> <p>Hosko said he still defends Comey for not pressing charges because the FBI always has to make a decision ""based on what they have"" at the time. Hosko said he thinks agents found emails that made them say, ""Oh my God look at what we have.""</p> <p>BREAKING NEWS → The FBI is reopening its investigation into Secretary Hillary Clinton.</p> <p>My full statement ⇩ pic.twitter.com/LHfyg46dWk — Paul Ryan (@SpeakerRyan) October 28, 2016</p> <p>House Speaker Paul Ryan called the FBI decision ""long overdue.""</p> <p>How many emails did the FBI find? Get your butt in gear, read them, assess them, form a conclusion. Letting this hang is so irresponsible. — Tommy Vietor (@TVietor08) October 28, 2016</p> <p>But former Obama administration spokesman Tommy Vietor chided the bureau on Twitter.</p> <p>Fox News' Ed Henry, Jennifer Griffin and Jake Gibson contributed to this report.</p>",Left,Right
785e479b-4cc4-4c56-9596-d3cf7cc5791f,Why The Racist And Homophobic ‘Duck Dynasty’ Comments Have Nothing To Do With Free Speech,Duck Dynasty Bigotry Controversy,"<p>CREDIT: @BoycottAETV</p> <p>On Wednesday, Duck Dynasty patriarch Phil Robertson made comments in a GQ interview condemning homosexuality as sinful and comparable to bestiality, as well as claiming that African Americans were better off under Jim Crow laws. A&E;, the network that airs the program, has since suspended Robertson from filming, prompting conservatives to rush to his defense. Even some prominent lawmakers are insisting that his free speech is in danger.</p> <p>Bobby Jindal (R), governor of Louisiana, which is where Duck Dynasty is filmed, argued that TV networks no longer believe in the First Amendment:</p> <p>Phil Robertson and his family are great citizens of the State of Louisiana. The politically correct crowd is tolerant of all viewpoints, except those they disagree with. I don’t agree with quite a bit of stuff I read in magazine interviews or see on TV. In fact, come to think of it, I find a good bit of it offensive. But I also acknowledge that this is a free country and everyone is entitled to express their views. In fact, I remember when TV networks believed in the First Amendment. It is a messed up situation when Miley Cyrus gets a laugh, and Phil Robertson gets suspended.</p> <p>Sen. David Vitter (R-LA), similarly claimed on Twitter that it was “wrong” that Robertson is being “penalized” for his faith. Sen. Ted Cruz (R-TX) offered on Facebook that “free speech matters”:</p> <p>If you believe in free speech or religious liberty, you should be deeply dismayed over the treatment of Phil Robertson. Phil expressed his personal views and his own religious faith; for that, he was suspended from his job. In a free society, anyone is free to disagree with him — but the mainstream media should not behave as the thought police censoring the views with which they disagree.</p> <p>Former half-term Alaska Gov. Sarah Palin (R) was similarly worried about the fate of free speech:</p> <p>Free speech is an endangered species. Those “intolerants” hatin’ and taking on the Duck Dynasty patriarch for voicing his personal opinion are taking on all of us.</p> <p>In addition, a Facebook page called Stand with Phil Robertson now has over 700,000 “Likes” — more than double what it had Thursday morning — and directs visitors to a “petition” that collects information for the Tea Party-affiliated Patriot Action Network and urges A&E; to apologize to Robertson. The conservative group Faith Driven Consumer has its own petition asserting that Robertson was “discriminated against” and should be reinstated immediately. A Twitter profile called simply @BoycottAETV now has over 11,000 followers, producing memes with messages like, “Freedom of speech is not just for liberals!” Even Herman Cain thinks “this crap is out of control.”</p> <p>These outraged messages have largely defended Robertson’s anti-gay comments as an expression of his religious beliefs without acknowledging his remarks that African Americans were better off without full civil rights. On that point, they have been notably silent. Moreover, nothing about this situation has anything to do with “free speech.”</p> <p>Robertson is a free man. He has not been arrested for his beliefs. He could continue to say whatever he’d like and, given the current media frenzy, it would probably be quickly published in many other places. Robertson could even take to his own website and publish whatever he wants to say, and individuals could share it through social media the world over. His freedom of speech has been in no way encumbered.</p> <p>A&E;, as a company, enjoys constitutional protections as well, and is under no obligation to provide a platform for messages it disagrees with. The network’s statement suspending Robertson from filming was telling in this regard: “His personal views in no way reflect those of A&E; Networks, who have always been strong supporters and champions of the LGBT community.” A&E; is not Robertson’s employer, lest it be forgotten that the show Duck Dynasty is about his actual business, Duck Commander, which produces duck calls and other related (and not-so-related) products.</p> <p>What actually is taking place is that conservatives are taking umbrage because a fellow conservative’s beliefs are being publicly criticized. This happens all the time. When Chick-fil-A head Dan Cathy, whose company gives millions of dollars annually to anti-gay groups, said that homosexuality is “twisted up kind of stuff” that is “inviting God’s judgment,” LGBT groups called for awareness-raising and boycotts while conservatives rushed to show their “appreciation.” The exact opposite happened when companies like Starbucks and General Mills announced their support for marriage equality: LGBT groups offered praise, while anti-gay groups vowed to dump their products.</p> <p>All of this is emblematic of free speech. Free speech allows citizens to say things that are offensive and unpopular and it allows other citizens to disagree, as well as to choose whether to provide an ongoing platform for those remarks. If anything, the claim that Robertson’s free speech has somehow been inhibited is just a straw man to avoid addressing the merits of what he actually said: that all gay people are going to Hell and that African Americans don’t deserve a seat at the lunch counter.</p>",Right,Left
7c036fff-6b2d-42d7-b1be-63e234a661f8,‘You will be made to care’,Duck Dynasty Bigotry Controversy,"<p>When I was a boy attending Wolfsville Elementary in Western, Maryland, a teacher took a poll to see what we wanted to be when we grew up. “Farmer” was the number one answer. “Truck driver” was number two. One of my classmates — a distant cousin — didn’t even get indoor plumbing until we got to middle school. This gives you an idea of the milieu.</p> <p>Today, I live in Northern Virginia. I take the Metro. I have a pet pug. Sometimes, I wear those nerdy glasses like the guy from Weezer. I’m vaguely aware of “Arcade Fire’s” oeuvre. My wife shops at Whole Foods, which (depending on your point of view) makes me both patriarchal and a hipster.</p> <p>I’m a little bit country and a little bit rock and roll.</p> <p>In this regard, I am perhaps the least likely person to care about the culture wars. In a way, I can identify with both sides. And yet, here I am…</p> <p>Last night, I presented a binary choice between the red state “Duck Dynasty” and the blue state “Pajama Boy.” In truth, I suspect a lot of us are really somewhere in the middle (since when did loving “vagina” and sipping hot chocolate in some cozy jammies become mutually exclusive? Aren’t these things like peas and carrots?)</p> <p>And since I personally couldn’t care less if you are gay or a redneck (or a gay redneck!), I would love nothing more than to live in a society that is tolerant and (not to say the sexes aren’t different) gender-blind, etc.</p> <p>But things are complicated by the fact that progressive activists and agitators aren’t interested in comity or stasis or accommodation. Instead, they view division and conflict as necessary steps to achieve their progressive goals (which seem to be the dismantling of any traditional value or institution.)</p> <p>As RedState’s Erick Erickson constantly reminds us: “You Will Be Made to Care.”</p> <p>And so, if you own a flower shop and — because of your religious convictions — decline to work for a gay wedding, you will be made to care. If your five-year old son makes a “gun gesture” with his hand, you will be made to care. If you’re a redneck in Louisiana who believes homosexuality is a sin, you will be made to care.</p> <p>At some point, this became a zero-sum game. You’re either in the “Duck Dynasty” camp or the “Pajama Boy” camp. Somebody will lose.</p> <p>No matter how hard you try, you simply cannot be a conscientious objector in the culture war.</p> <p>Just when I thought I was out…they pull me back in.</p>",Left,Right
7c2cb8c3-1d40-4dae-89e1-e2f6b2e90caf,UCC Was Not A ‘Gun Free Zone’ Because Public Colleges In Oregon Can’t Ban Guns,Shooting in Oregon,"<p>On Thursday, a shooter reported killed at least 13 people and injured many others at a community college in Oregon. Just minutes after the incident, commentators sought to attribute the incident to the fact that Umpqua Community College was a “gun free zone.”</p> <p>“The gun free zones are the areas that tell licensed gun owners that you are not allowed to carry your weapon in this facility…If you’re going to perpetrate some act, you know that most people are not going to be armed,” CNN “military analyst” Rick Francona said a few minutes after the shooting.</p> <p>A retired Navy Seal, Jonathan Gilliam, also appearing on CNN, went even further. Blaming the “gun free zone” for the scope of the tragedy and adding “the only thing that’s going to stop a gun is another gun.”</p> <p>Umpqua Community College, however, was not a gun free zone. A 2011, state court decision prohibited public colleges from banning guns on campus. The decision stemmed from a suit filed by the Oregon Firearm Education Foundation, a gun rights group. There was an effort to pass a new law to reinstate the ability of public colleges to ban guns. That measure was defeated by gun rights advocates.</p> <p>Update:</p> <p>The conservative site Breitbart and others assert that guns were banned at UCC. This is not true. The student code of conduct bans guns “without written authorization.” Under Oregon law, the university could not ban people with a valid concealed carry license from bringing their weapons on campus. (They could ban gun from various buildings and facilities.) Conservative writer Dana Loesch, who initially claimed the campus was a “gun free zone,” updated her article to clarify that individuals with concealed carry permits were allowed to bring guns on campus.</p> <p>There was, in fact, someone on campus with a concealed carry weapon at the time of the massacre. A local reporter explained to CNN that it was legal for him to have such a weapon on campus.</p>",Right,Left
8d7a6af4-fd80-4f55-b57f-1b8d52e02ff3,Trump Puts Pressure On NAFTA Talks With More Tariff Threats,"President Donald Trump continued to call for changes to U.S. trade deals on Monday, saying that he’s open to pulling back on the tariffs he plans to impose on international trade partners if Mexico and Canada come to the table and renegotiate the North American Free Trade Agreement.","<p>President Donald Trump continued to call for changes to U.S. trade deals on Monday, saying that he’s open to pulling back on the tariffs he plans to impose on international trade partners if Mexico and Canada come to the table and renegotiate the North American Free Trade Agreement.</p> <p>Trump announced his intention to slap a 25 percent tariff on steel imports and a 10 percent tariff on aluminum imports on Thursday. He didn’t specify which countries the measures would apply to but White House trade adviser Peter Navarro told CNN’s “State of the Union” Sunday that no countries would be exempt.</p> <p>Major U.S. trade partners, including both Canada and Mexico, hit back at Trump and threatened retaliatory measures last week.</p> <p>We have large trade deficits with Mexico and Canada. NAFTA, which is under renegotiation right now, has been a bad deal for U.S.A. Massive relocation of companies & jobs. Tariffs on Steel and Aluminum will only come off if new & fair NAFTA agreement is signed. Also, Canada must.. — Donald J. Trump (@realDonaldTrump) March 5, 2018</p> <p>...treat our farmers much better. Highly restrictive. Mexico must do much more on stopping drugs from pouring into the U.S. They have not done what needs to be done. Millions of people addicted and dying. — Donald J. Trump (@realDonaldTrump) March 5, 2018</p> <p>Trump has threatened to pull out of NAFTA for two years unless the United States can agree to a renegotiated deal with Canada and Mexico that Trump views as more beneficial to the U.S. NAFTA talks have been underway without much progress for the last six months. The latest round of negotiations was scheduled to take place between ministers from all three countries on Monday.</p>",Right,Left
