docid,title,event,full_text,human_label,outlet_bias
288875e9-080e-44b0-8098-f9b66e26a141,It’s Likely TOO LATE For Moore To Drop Out,"Roy Moore, the highly conservative Republican candidate for Alabama's open Senate seat, has been accused of sexually assaulting a 14 year old when he was 32 years old.","<p>FAIRHOPE, AL - SEPTEMBER 25: Republican candidate for the U.S. Senate in Alabama, Roy Moore, speaks at a campaign rally on September 25, 2017 in Fairhope, Alabama. Moore is running in a primary runoff election against incumbent Luther Strange for the seat vacated when Jeff Sessions was appointed U.S. Attorney General by President Donald Trump. The runoff election is scheduled for September 26. (Photo by Scott Olson/Getty Images)</p> <p>It is likely too late for Republican Senate nominee of Alabama Roy Moore to step down, The Daily Caller News Foundation has learned.</p> <p>Moore could conceivably step down if is he personally resigns, but that decision would have to go through the Alabama secretary of state–the state’s chief elections official–who would then have to make a ruling as to whether or not Moore could withdraw from the race. Essentially, the secretary would have to allow him to step down.</p> <p>Even if the secretary approved Moore’s resignation, it isn’t likely that he would be kicked off the ticket, as the ballots have already been printed for the upcoming election, The Daily Caller News Foundation has learned.</p> <p>The other way Moore could abdicate the ballot is through some form of legal action, but, since the current situation is unprecedented in Alabama politics, no one knows how that would work.</p> <p>Even if Moore was allowed to step down, Alabama state election laws bar nominations within 76 days of election day. The election is scheduled to take place Dec. 12, which is only 33 days from Thursday.</p> <p>“The state executive committee, in cases where the office to be filled is not a county office, and the county executive committee, in cases where the office to be filled is a county office, but subject to the approval of and in accordance with the method prescribed by the state executive committee, where a vacancy may occur in any nomination, either by death, resignation, revocation, or otherwise, or in case of any special election, may fill such vacancy, either by action of the committee itself or by such other method as such committee may see fit to pursue. The respective state or county executive committee shall file with the Secretary of State, for a state or federal office, or with the judge of probate, for a county office, the name of the candidate to fill such vacancy not later than 76 days before the election,” the law states.</p> <p>Senate Majority Leader Mitch McConnell said that Moore should step down as the Republican nominee in the Alabama Senate race if Thursday’s reports of sexual harassment are true.</p> <p>“If these allegations are true, he must step aside,” McConnell said Thursday.</p> <p>A total of four women came forwarded Thursday afternoon that allege Moore had inappropriate sexual contact with them while they were under the age of 18-years-old, The Washington Post reported Thursday. While none of the women report having sex with Moore, all say they were inappropriately touched and had other unwanted advances.</p> <p>Moore’s resignation is made all the more unlikely by the fact that he’s publicly called these allegations “fake news,” in an attempt to throw doubt on the women’s claims.</p> <p>“These allegations are completely false and are a desperate political attack by the National Democrat Party and the Washington Post on this campaign,” Moore said.</p> <p>Follow Robert on Twitter</p> <p>Send tips to [email protected]</p> <p>Content created by The Daily Caller News Foundation is available without charge to any eligible news publisher that can provide a large audience. For licensing opportunities of our original content, please contact [email protected].</p>",Left,Right
2cd002af-bd38-4acb-8b25-124e0b246ad6,"Trump: Never saw McCabe take notes, 'Can we call them fake memos?'","President Donald Trump on Sunday sent out a series of tweets about Special Counsel Robert Mueller's Russia investigation, former FBI director James Comey, and former FBI deputy director Andrew McCabe. These tweets came after McCabe was fired by Attorney General Jeff Sessions on Friday and after it was reported that McCabe had kept memos on his meetings with the president, similar to Comey.","<p>President Trump responded Sunday to reports that fired FBI official Andrew McCabe took notes of their conversations, saying he never saw McCabe write down messages and suggesting the purported notes be called “fake memos,” like those purportedly taken by “lying James Comey” -- the FBI director fired by Trump.</p> <p>McCabe, the onetime FBI deputy director long scorned by Trump, was fired Friday evening, two days short of his retirement and receiving a full pension.</p> <p>The firing was followed by reports that McCabe kept personal memos detailing interactions with the president. The memos reportedly have been provided to the office of the special counsel conducting the Russia investigation and are similar to the notes compiled by Comey.</p> <p>“Spent very little time with Andrew McCabe, but he never took notes when he was with me,” Trump tweeted. “I don’t believe he made memos except to help his own agenda, probably at a later date. Same with lying James Comey. Can we call them Fake Memos?”</p> <p>The memos could factor into Special Counsel Robert Mueller's investigation as his team examines Trump campaign ties to Russia and possible obstruction of justice.</p> <p>McCabe's memos include details of his own interactions with the president, according to a person with direct knowledge of the situation who wasn't authorized to discuss the notes publicly and spoke on condition of anonymity.</p> <p>Trump on Sunday also tweeted: Why does the Mueller team have 13 hardened Democrats, some big Crooked Hillary supporters, and Zero Republicans? Another Dem recently added...does anyone think this is fair? And yet, there is NO COLLUSION!”</p> <p>McCabe’s memos also recount different conversations he had with Comey.</p> <p>Trump on Saturday tweeted that McCabe's firing by Attorney General Jeff Sessions was ""a great day for Democracy"" and asserted without elaboration that McCabe knew ""all about the lies and corruption going on at the highest levels off the FBI!""</p> <p>In the past year, Trump has repeatedly condemned McCabe as emblematic of an FBI that he insists is biased against his administration.</p> <p>Sessions said he acted on the recommendation of FBI disciplinary officials who said McCabe had not been candid with a watchdog office investigation.</p> <p>An upcoming inspector general's report is expected to conclude that McCabe, who spent more than 20 years with the FBI, had authorized the release of information to the media and was not forthcoming with the watchdog office as it examined the bureau's handling of the Hillary Clinton email investigation.</p> <p>McCabe has vigorously disputed the allegations and said his credibility had been attacked as ""part of a larger effort not just to slander me personally"" but also the FBI and law enforcement.</p>",Left,Right
303c24d2-860a-4d21-b426-5f22273bdaa5,Phoenix Motel 6 accused of notifying ICE about undocumented patrons,"Motel 6 is facing controversy after a report revealed that employees in Phoenix, Arizona locations were handing over guest information to U.S. Immigration and Customs Enforcement (ICE). A spokeswoman for the motel chain has since said that the employees have stopped working with ICE employees after the report was released and senior management was made aware of the situation.","<p>After one of its locations was accused of tipping off Immigration and Customs Enforcement (ICE) agents about patrons who may have been in the U.S. illegally staying at its locations, Motel 6</p> <p>The motel chain confirmed on Twitter that company employees were providing daily guest lists to ICE.</p> <p>""Over the past several days, it was brought to our attentio that certain local Motel 6 properties in the Phoenix-area were voluntarily providing daily guest lists to Immigration and Customs Enforcement (ICE). As previously stated, this was undertaken at the local level without the knowledge of senior management. When we became aware of it, it was discontinued,"" the statement read.</p> <p>Motel 6 added that the company is issuing a directive to all of its locations that sending ICE daily lists of guests staying at Motel 6s is ""prohibited.""</p> <p>At least 20 arrests were made by ICE agents at two Phoenix Motel 6s between February and August, the Phoenix News Times reported. The motels were located in regions with a high Latino population.</p> <p>ILLEGAL IMMIGRANTS GET OK TO VOTE IN MARYLAND CITY'S ELECTION</p> <p>Robert McWhirter, an attorney for a former guest of the motel, Jose Renteria Alvarado, said the business shared its guest logs with the agents, KPHO reported. Alvarado was arrested in June while staying at the motel and could face deportation.</p> <p>""I imagine what went on here is they probably took a look at the names on the guest registry and compared that to a database of people that have been deported,"" McWhirter told KPHO.</p> <p>Alvarado has been deported once previously due to a criminal record, and could now face six months in prison and then be deported.</p> <p>WHAT IS DACA AND WHY IS THE TRUMP ADMINISTRATION ENDING IT?</p> <p>Virginia Kice, a spokeswoman for ICE, told KPHO she could not disclose where the agents get their information.</p> <p>""The agency receives viable enforcement tips from a host of sources, including other law enforcement agencies, relevant databases, crime victims, and the general public via the agency’s tip line and online tip form…” Kice said.</p> <p>She added: ""It’s worth noting that hotels and motels, including those in the Phoenix area, have frequently been exploited by criminal organizations engaged in highly dangerous illegal enterprises, including human trafficking and human smuggling.""</p> <p>Motel 6's statement said the company apologizes for the incident, and that it will be reviewing and reissuing updates company guidelines.</p>",Left,Right
33ed677d-ab9b-4daf-bb26-1cd095d7dfa5,Obama to sign executive order raising minimum wage for federal contractors,Obama raises minimum wage for contractors,"<p>President Obama, in the first of potentially many executive actions tied to his State of the Union address, will unilaterally increase the minimum wage for workers under new federal contracts to $10.10 an hour, from $7.25, in an effort to build momentum for a minimum wage hike for all Americans.</p> <p>The executive order, which had been pushed by progressive Democratic lawmakers, applies to all contractors performing services for the federal government and would affect more than 2 million employees, according to an administration official.</p> <p>The president will then use Tuesday night's address to press Congress to pass a Democratic plan to increase the overall federal wage to $10.10 over three years, then indexing it to inflation, while also raising the minimum wage for tipped workers, the official said.</p> <p>Critics of the minimum wage push claim that raising the rate could have an adverse effect, discouraging businesses from hiring more workers at a time when the government is trying to spur job growth.</p> <p>""The minimum wage is mostly an entry level wage for young people,"" Senate GOP Leader Mitch McConnell told ""Fox News Sunday."" ""We have a crisis in employment among young people right now, and generation 18 to 30, people that got out of college, are finding there are no jobs for them. The last thing we want to do is have even fewer jobs for younger people.""</p> <p>But the president is reviving the issue as he tries to focus again on the economy. Obama, who does not have the power to unilaterally raise the minimum wage for private sector workers, also used last year's State of the Union speech to call for a federal minimum wage hike.</p> <p>“Let’s declare that in the wealthiest nation on Earth, no one who works full-time should have to live in poverty and raise the federal minimum wage to $9 an hour,” the president said to applause in his 2013 address.</p> <p>The new executive order affects only future contracts, not existing ones, and would only apply to contract renewals if other terms of the agreement changed. As a result, the order would benefit far fewer workers than the number foreseen by advocates of federal contract employees.</p> <p>House Speaker John Boehner downplayed the impact the latest executive order would have. ""Let's understand something: this affects not one current contract, it only affects future contracts with the federal government. And so I think the question is, how many people, Mr. President will this executive action actually help? I suspect the answer is somewhere close to zero,"" he said Tuesday.</p> <p>In December, Reps. Keith Ellison, D-Minn., and Raul Grijalva, D-Ariz., co-chairmen of the Congressional Progressive Caucus, wrote the president urging him to take the ""bold step"" of signing an executive order to increase wages for federal contractors, GovExec.com reported.</p> <p>At the time, White House Press Secretary Jay Carney issued a lukewarm response when asked about the lawmakers' request, according to the report.</p> <p>“This has always been done legislatively. And it has been done with support from Republicans and not just Democrats in the past,” Carney said.</p> <p>Obama, in an effort to avoid the appearance of being a lame duck president, is expected to use Tuesday's State of the Union address to make clear his intentions to use his executive powers to achieve his goals when Congress fails to pass legislation.</p> <p>Minimum wage is a perennial issue that has taken on a higher profile amid the slowly recovering economy and growing public debate about income inequality. A Quinnipiac University poll this month found 71 percent of Americans in favor of raising the minimum wage — including more than half of Republicans polled.</p> <p>Five states passed minimum wage measures last year, and advocates hope that number will grow as states from New Hampshire to Washington consider proposals. Many would push families above the federal poverty line, which is $15,730 for a family of two. In Iowa, a bill would hike the minimum wage from $7.25 an hour to $10.10.</p> <p>Democrats across the political spectrum have lobbied for a higher minimum wage this year, after Obama got the ball rolling on the issue by calling for an increase in his February budget speech. Since then, union-organized demonstrations in front of profitable mega-chains such as Wal-Mart and McDonald's have kept it in the public eye.</p>",Left,Right
3560b060-d18d-4e5d-92d8-618e51aa46fc,"Bernie Boosts Hillary, Gets Booed","The opening was unruly, with the firing of the DNC Chairman and unruly Sanders supporters. But the evening was all about unity.","<p>Photo: Aaron P. Bernstein</p> <p>The modern political convention is supposed to be an infomercial, one in which all intra-party tensions have been airbrushed away. But the Democrats find themselves at risk of throwing a convention that does the exact opposite — projecting an image of a party far more wracked by internecine conflict than it actually is.</p> <p>On Monday night in Philadelphia, Bernie Sanders will address the Democratic National Convention in prime time. Over the past 72 hours, the stakes of that address have increased significantly. At the end of last week, WikiLeaks published emails between staffers at the Democratic National Committee, which made vivid and explicit what had previously been opaque but assumed — the DNC did not want Bernie Sanders to win the Democratic primary, and put its thumb gently on the scales (to a degree that had no significant influence on the primary’s ultimate result).</p> <p>Then a new batch of polls showed Donald Trump’s festival of pseudo-fascism last week played exceedingly well among white, blue-collar voters — so well that, in a CNN/ORC poll, he now leads Clinton by five points. In that poll, 25 percent of Sanders supporters pledge their allegiance to either Green Party candidate Jill Stein or Libertarian nominee Gary Johnson, when presented with those choices.</p> <p>The emails development — combined with Clinton’s selection of moderate Virginia senator Tim Kaine as her running mate — has injected new energy into Sanders’s most die-hard supporters, the ones who hope to (somehow) nominate the Vermont senator this week, or at least to ruin Clinton’s infomercial. The party has tried, unsuccessfully, to placate this faction, by bringing Florida congressperson (and Sanders nemesis) Debbie Wasserman Schultz’s tenure at the Democratic National Comittee to an untimely end.</p> <p>Meanwhile, the tightening polls suggest that, contrary to the conventional wisdom of a month ago, Clinton is going to need every last anti-Trump vote she can get this November.</p> <p>Crowd of Bernie delegates chanting ""We are the 1900,"" ""no fracked gas,"" ""bankers go to jail"" and a few other things near a meeting room — Kate Aronoff (@KateAronoff) July 25, 2016</p> <p>The dress rehearsal for that speech suggests these two goals may be mutually exclusive.</p> <p>“Immediately, right now, we have got to defeat Donald Trump,” Sanders said to hundreds of his delegates on Monday afternoon. “ And we have got to elect Hillary Clinton and Tim Kaine.”</p> <p>The delegates enjoyed the first half of this message. They did not like the second.</p> <p>The crowd reacts to @BernieSanders saying: ""We have got to elect Hillary Clinton and Tim Kaine"" pic.twitter.com/7v3puhTdLM — POLITICO (@politico) July 25, 2016</p> <p>“Brothers and sisters, brothers and sisters, this is the real world that we live in,” Sanders continued.</p> <p>Moments after booing Sanders, the delegates rebutted his plea for realism with cheers, chanting, “We want Bernie! We want Bernie!”</p> <p>The socialist senator made clear that his invocation of the “real world” was not intended to discourage the crowd’s broader aspirations for radical change. Rather, Sanders argued that the tactic that was his presidential campaign has run its course. Now the movement must focus on keeping a dangerous demagogue out of the White House, while building strength on the local level.</p> <p>“Real politics is not necessarily sexy,” Sanders said. “You have heard me say a million times that this campaign is not just about electing a president, as important as that is … It is building a movement to transform this country. Election Days come and go, but the fight for social, economic, racial, and environmental justice continues.”</p> <p>It’s not clear whether this message will pacify the most committed Sandernistas within the senator’s delegation. Even if it doesn’t, their numbers might not be large enough to make their presence felt inside a Wells Fargo Center packed with Clinton-backers and more placid Sanders fans. The Vermont senator will reportedly have a whip operation on the convention floor, ready and waiting to squelch conspicuous dissent.</p> <p>Bernie texts his delegate whips: Please don't protest on the DNC floor, via @lizcgoodwin https://t.co/aZhhQklYLg pic.twitter.com/uXHfH2BUCQ — Colin Campbell (@BKcolin) July 25, 2016</p> <p>If that whipping proves insufficient, however, the Democrats could end up doing something akin to a (mostly) happy family sending out a Christmas card of their worst dinner-table spat. As Philip Bump of the Washington Post notes, the Democratic Party is more unified than it appears</p> <p>Pew Research has been polling on the 2016 campaign for months, allowing it to track attitudes among voters over time. Nearly half of the Democratic electorate, 44 percent, changed their preference over the course of the three surveys Pew conducted. About 3 in 10 supported Clinton, wire-to-wire; about 20 percent Sanders. Pew asked those consistent Sanders supporters whom they support in the general election. Ninety percent said they back Hillary Clinton.</p> <p>Pew’s findings are in slight tension with those from CNN. But neither suggests that the level of animosity many Sanders delegates feel for Clinton is representative of his followers writ large.</p> <p>The image projected by tonight’s speech, however, may suggest otherwise.</p>",Right,Left
43353164-939f-4d58-9856-6577b3a49389,Donald Trump Addresses Natasha Stoynoff Sexua,"Following the release of the 2005 taped comments made by Donald Trump, and his defense during the 2nd presidential debate that they were just ""locker room talk"", multiple women have come forth saying that he sexually assaulted them.","<p>Donald Trump implied that the woman who accused of him of sexually harassing her wasn’t attractive enough for him to do something like that.</p> <p>After Natasha Stoynoff accused the Republican nominee of “shoving his tongue” down her throat while she was writing a story about his and Melania’s anniversary, he disputed her claims during a rally in West Palm Beach Thursday.</p> <p>“Think of it,” he said. “She’s doing a story on Melania, who’s pregnant at the time, and Donald Trump — our one year anniversary. And she said I made inappropriate advances, and by the way, the area was a public area — people all over the place.”</p> <p>“Take a look, you take a look, look at her — look at her words — you tell me what you think. I don’t think so. I don’t think so.”</p>",Left,Right
46c59a4c-86b2-4b10-be35-6eddd314ca2a,‘Stump For Trump’ Girls Suggest Rubio ‘May Have Had A Gay Lifestyle’ [VIDEO],Rubio Unleashes On Trump,"<p>Donald Trump super fans Diamond and Silk suggest that Sen. [crscore]Marco Rubio[/crscore] “owes America and the gay community an apology because it sounds like that he may have had a gay lifestyle in his past.”</p> <p>In an interview on “CNN Newsroom With Carol Costello” on Friday, Lynette “Diamond” Hardaway and Rochelle “Silk” Richardson — a.k.a. the “Stump for Trump” girls — made the allegation in an attempt to defend Trump from Rubio’s criticism about Trump’s business practices.</p> <p>Costello said, “I want to show that video once again of [crscore]Ted Cruz[/crscore] and Senator Marco Rubio shaking hands behind Donald Trump’s back during a commercial break. So, Lynnette [Diamond], when you see that, what goes through your mind?”</p> <p>Diamond replied, “Well, you know, I think that Ted Cruz and Marco Rubio, they’re both snakes.”</p> <p>Silk interjected, “That’s right.”</p> <p>“When I look at Marco Rubio, Marco Rubio told us to Google Donald Trump, but I did one better. I Googled him. And when I Googled him, you know, he owes America and the gay community an apology because it sounds like that he may have had a gay lifestyle in his past,” Diamond claimed.</p> <p>Shocked, Costello interjected, “What?”</p> <p>Diamond continued, “He owes people an apology.”</p> <p>“No, Lynnette [Diamond],” Costello said.</p> <p>“All you have to do is Google him,” Diamonds said. Silk echoed, “Google.”</p> <p>A disapproving Costello said, “Lynnette [Diamond]…”</p> <p>Do You Care If A Presidential Candidate Is Gay? Yes No Login with your social identity to vote Thanks for participating in this survey, in order to vote you must register with your email address.</p> <p>Sign out.</p> <p>“Google him and you will see that that’s what’s on Google. So you have to be cautious when you tell people to Google people. Stuff will come up. Now, we don’t know if it’s true so we’ll say allegedly. But he shouldn’t have told people to Google Donald because I Googled him and stuff came up,” Diamond said.</p> <p>During Thursday night’s debate, Rubio told the audience to Google “Donald Trump Polish Worker” and they would be shocked by what they found. Rubio claimed that Trump hired illegal workers “from Poland and he had to pay a million dollars or so in a judgment.” According to Politifact, Rubio’s claim was half true because “It was Trump’s contractor, not Trump himself, who hired 200 undocumented Polish workers to demolish a building to make room for Trump Tower in Manhattan. Trump said he didn’t know. The lawsuit sought $1 million in damages, and a judge ruled that Trump had to pay $325,000 plus interest.”</p> <p>Follow Steve on Twitter and Facebook</p>",Left,Right
